content,score
lebih bagus magic chess di aplikasi ml,1
GAME NYA BAGUS TAPI KENPA SERING LAG KALO LAGI PERNG PADAHAL SINYAL BAGUS GA BURUK TAPI SISI LAINYA BAGUS BANGET TAPI ADA JUGA SISI BURUKNYA SEPERTI SERING MENGELUARKAN SUARA MESIN CUKUR PADAHAL HP NYA BAGUS DAN MAHAL DAN BERHARGA UNTUK,4
oke mantap gamenya,5
gaada lawan yang lebih susah kah,1
lag dan restart padahal sinyal bagus,1
"ini fitur ganti bendera gimana dah, udaj nunggu 3 bulan pas mau diganti ""barang tidak sesuai"", disuruh beli change flag di shop, barangnya ga ada, cuqimay",2
sampai ada game sebelah yg tutup gamenya .... wadidaw. apakah tak sanggup menyaingi.. gile sih Magic Chess inovasi game yg cukup menarik gk monoton,4
"gane aneh internet lancar tiba"" menghubungkan ulang",1
"ini kenapa ko menggunakan terus. sinyal udah oke, kuota banyak, ku coba pake wi.fi sama ajah menghubungkan terus ini games. tolong di perbaiki",3
game buatan monton ngak ada yang bagus..di ml drak system berkeliaran di mc sering reconet padahal sinyal bagus..game busukl ngak usah maen ini game..monton kalau ngak bisa bikin game ngak usah bikin,1
lgi main tiba2 koneksi padahal jaringan lancar,1
tolong dong knpa mental Mulu sih pdahal koneksi bagus ruang penyimpanan juga sama masih besar tapi mental Mulu aneh ini game,2
"mkn kesini mkn gk jls, susah bngt nyari hero yg di butuhkan. udah game'y aneh, gw sinergi sudah jdi msh kalah sma sinergi yg blom jdi.",1
"monton balikin odet elementalis guaaaaa, gua kalah muluuuuu sekaranggg",1
kembalikan mode practice buat semua orang,1
"bagus, gw lagi pelajarin cara main game nya",4
game ga mutu mmx di seting ama montod,1
sy suka sekali dengan game ini,5
"permainan yg sangat tidak adil, stok hero masih penuh tapi bisa refresh toko sampai miskin gak muncul, sedangkan lawan sdh bisa *2-*3",1
sistem ajg masak tiap hari kena drak sistem mulu,2
"gameny bagus, sinerginy tolong di tambahkan lagi supaya lebih bervariatif, kalo bisa commander ny hanya untuk kosmtik aja jgn ada damage ny agar permainan lebih berimbang.",5
moskov damage g ngotak,2
manaa lunoxx guaaa woiiiii dari tadi mainn kagak dapett lunoxxx,2
game ngantuk,1
"kaku kali ngelag"" gk seru enakan yg lama",1
game anj**,1
kelas kinggggggghg,5
seru gelo,5
main kurang 1 Hero gapernah dpt,1
"ayoolah untuk sistem download data nya jangan di pending download trs, pdhl sinyal wifi lancar lancar aja stabil malaan",3
baru dowload kalah mulu gw anj,2
sangat baik untuk mengatasi ke bosanan,5
suka heran gw sama game ini punya gw sinergi udh full masih tetap kalah sama yg gak ada sinergi padahal bintang masih 2 musuh nya tapi gw kalah padahal sinergi full bintang 3,2
"aneh banget hero udah bintang 2 nya 2 di lane up udah ada 2 ngabisin 50 koin gak dapet dapet hero 1 doang tinggal 1. pembagian heronya juga gak rata sama sekali beda kayak magic chest yang dulu sistemnya lebih ribet, kacau, gak jelas. perbaiki lagi mau top up malah sistemnya kayak pea... ini emang sengaja apa gimana akun saya gak pernah dapet hero yang bagus aneh banget benerin sistemnya tolol",1
intinya game nya seru,5
"sangat tidak recomended,,, byk player cheater membuat game semakin tidak seru. bahkan pembagian match item dan gogo card sgt tidak adil",1
bagus gem nya,4
hapus aja commander wanwan bego op hama gitu gak dinerf² ppek,1
"Game tolol, di season 2 ini ada comander jonson yang seperti dulu. Bisa2 nya sekali nabrak dikasih item magic damage sampe 40k, mikir apa developer moonton? Pusing lu? Sakit lu?. Konsep season2 MCGG sekarang gak ada kreatifnya cuma duplikat masa lampau aja.",1
"apalah, comandernya ada yang ilang, masa tadinya pas masih nyatu sama mlbb punya Eva, sekarang kudu beli lagi Eva nya",4
mejik cees gok gok,5
nerf combo global yaitu nerf weapon master sama mm dan nerf argus lifestell nya dan nerf moskov dan yan terpenting nerf jumlah gold yang di dapat dari commander wanwan yaitu maksimal gold yang didapat hanya 1 gold atau 2 lah biar commander Chou kepakai,1
"game rusak, burik",1
sangat seruuu gays buruan di download👈🏻,5
fokus aja di tindak kecurangan deh kayak nya,4
aku meyukai permain ini,5
"untuk dari segi permainan nya udah baik cuma terkadang ada yang sulit mendapatkan Hero yang sama,dan untuk menaikkan level rank nya memang harus berjuang agak sulit, nggak tau apakah udah di atur sama monton/memang level lawan yang kuat",5
BRING MY MC OLD,1
Menentukan seberapa jago tim kita,5
game rusak sekali kalah langsung mau kalah,1
sekarang ada iklannya kocak bener aneh,2
keren bg aku main gara gara bang windut angkat celana,3
bikin kecanduan jadi hancur peran suami dlm rumah tangga,1
"tolol hanying, capek bgt gw. Yang make sinergi itu gue doang, tapi susah nya minta ampun buat nyari hero. Padahal hero masih penuh, kaga ada yang make, kalo hero 4/5gold okelah nunggu lategame, lah ini hero 3 gold popol hanying itu kaga keluar2, udah mau lv 7, anying kesel banget gua. SISTEM LO BENERIN KOCAK Udah capek gw, mnding uninstall drpd stres sm sistem lo asw",1
game nya seru tapi aku ga kebagian kode,4
jelek gamenya,1
bagussekali,4
"bikin Hero GK mikir,, moskov terlalu broken,, haya B3 kalah Ama moskov B2..manajamen kalian mending d perbaiki aj..yg main kami, JD dengerin apa kata player.",1
server terputus mulu meskipun koneksi lancar,1
"Terbaik buat dimainkan,..",5
update ga balance ngawurrrrr,1
gamenya jelek banget jangan di download ya gaes. tapi boong hayuuu gema bagus banget tapi...................,5
kenapa fitur mode practice di advance server hanya untuk konten kreator? sangat tidak adil bagi bukan yang konten kreator,1
"game seru,mantap, jangan sampai lebih dari 5gb yaa",5
Maaf Karena Sering Lostreak Ga Pernah Menang,1
tolong combonya dirubah lg seperti awal,5
tolong bikinin mcgg offline juga dong moonton kaya mlbb ada versi offline nya juga,5
serius ni? gue top up 2 weekly pas belum ada yg masuk balikin uang gue woy gue top up moonton bukan sedekah uang ke lo,1
"hero moskov, ga wajar damage ga setara hero gold 5 lainnya, ga masuk akal",2
game sampah gak seimbang kalo mau seimbang semua sinergi di buwat sama jadi gak ada rebutan hero,1
aneh masa udah download fullbalik ke ORI suruh download lagi balik lagi ke Advan download lagi ribet sistem bikin lama,1
BENERIN DLU DARK SYSTEM ML LAH,1
"monton tolong lah gamenya tambah dirusakin, biar musuhnya setara dgn skill kita",1
"game ngebug, game kurang puas, game ra adil, game boy",1
sampah hero hama hapus aja gk punya skilll,1
"GAME BURIX ,NYARI HERO MINTA AMPUN, MAU MENANG DI BIKIN KAMBEK WOY MOONTON, BANYAK KELUH KESAH NGGA ADA RESPON SAMA SEKALI ,UDAH SINYAL JELEK,KOMBO NGGA SESUAI PANTES AJA RANTINGNYA RENDAH",1
gak bermutu ... pilih kasih ...,1
sekarang mangkin gak jelas lebih seru season pertama 😒😒,2
"tolong dong moonton masa di game nya ada cheat trus udah di laporkan malah gak di konfirmasi lagi nyusahin, TOLONG DI BENAR KAN LAGI",1
oi game lu gak adil gua ngerol di LV 9 gak dapat haya sedangkan musuh di lv8 malah dapat game anzin6,1
"magic cest dari dulu sama masalah nya,, gak adil antara player ada yang lucky ada yang nggak....jadi gameplay nya gak seimbang (berat sebelah) ada yang bagus shope nya ada yang busuk.... kalau bisa disetarakan baru adil saya player lama kecewa",2
kalau dah menang game selanjutnya malah scam rollnya,1
"masih ada orang yang bisa ngecheat di MC gogo, cari aja di tiktok",1
"change untuk mendapatkan hero yang dibutuhkan tinggi tapi sering gak muncul hero yang dinginkan, padahal stock hero tersebut masih lumayan banyak;)",1
sy sangat puas,5
"Hero yang di butuhkan gak pernah keluar, ini akun gw yang ga hoki apa emang sistem monton yang kaya TAII...",1
Game tai,5
"Kurangya skil comader yg lebih bervariasi seperti dulu, sungguh di sayangkan",1
tolong tambahin starkor macam magic chess dulu..mmin,5
"balikin magic chesss yg dulu,,,,.. kenapa, karna magic chesss yg sekarang gk bisa buat xperimen, harus modal hoki doang ini mah",1
"setiap maen pasti lag. masa mau ambil item aja susah. padahal jaringan,internet,hp dah lebih dari cukup. kecewa",1
terlalu sering update jadi ga seru,1
masih enakan MC yg dulu. semenjak upgrat syaa gak pernah maen MC bahkan saya uninstal ml dn MC. tolong moonton kembalikan megic chess yg dulu. karna lebih seru dan lebih menghibur,1
susahnya nyari sinergi kabom mage dari awal gameplay sampe lose pun ga di kasih nyesel gw instal lg,1
GX suka enk yng kemarin ini mah pusing udh jadi semua juga masih kalah Poko nya mah hapuss ml Gogo berat,1
game terlalu pelit dalam mengasih hero,1
GK bisa matching ke dalam permainan.... masalah jaringan....pake wifi tetap aja GK bisa...pake data seluler sama aja ini game busuk yang pernah ada.... uninstall game burik,1
"error gak jelas , utamakan kenyamanan pengguna donk..",1
banyak citt barusan ketemu cit mohon di tingkat kan sistem ke amanan nya moonton?,1
nature spirit kenapa di hapus moonton untuk saat ini bintang satu aja,1
ga asik,1
"KEMBALIKAN MC OLD, YANG INI BANYAK BUG",1
KEMBALIKAN MAGIC CHESS KAMI!!!,5
Eruditio gw jangan di nerf lah monton,4
GAME LAWAK... SEASON BARU KOK LANGSUNG ADA YG MYTHIC....FRAUD BGT... BUG BUANYAAAAAAK.... LAWAN GK SEIMBANG KETIKA SUDAH MYTHIC......TIBA-TIBA KONEKSI PUTUS PAS DAPET HERO YG DIINGINKAN.....AMPAS 🤧🤧🤧LAWAAAAK BGT REPORT DIBATASI.... GAME AMPASSSSSSS... AMPASSSSSS... AMPASSSSSSSS.... AMPAAAAAAAASSSS👎👎👎👎👎👎👎👎👎👎👎👎👎👎👎👎👎👎👎👎👎👎👎👎👎👎👎👎👎👎👎👎👎👎👎👎,1
"Aneh game nya, yang ngasal dikasih menang, yang mainnya bener dikasih kalah, gimana sih, kalo gk bisa bikin game gak usah bikin",1
glory gk bisa main 4 aneh amat ubah lagi lah kalo di kembalikan aku kasi bintang 5 nih,3
"perpindahan item tidak cepat,sinyal mendadak menghilang, akurat seperti boot seperti sudah diperkirakan siapa yang menang.",2
game catur,5
mb kecil tapi mengunduh nya lama buanget..udah mode 5G sinyalnya tetep aja luammaaa,3
"saya kasih bintang 5,karena game nya bagus,tapi tolong untuk developer nya untuk kembalikan mode gold rush nyaa😃😃",5
kalau koneksi kita sedang ngelag gak bisa masuk di perbaiki tolong,1
"gamenya bagus, klo yg dulu pernah main game ini di ML pasti paham",5
"tolong diperbaiki lagi masalah hero masak level 9 dapat hero gold 5 kalah sama yg level 8 dalam dapat hero gold 5 , ngeroll sampe uang habis gak dapat2 kocak amat",5
"main mode tag ampas, dapet team yang sering afk gk main sama sekali tidak ada menu report team yang sengaja kalah di afkin",1
kenapa Commander tharz hilang dan tidak ada di saya?,1
gimna si ini game masa gua gak di kasih Hero anj tapi seru juga,2
Sampah.,1
"gem ta*, gw nyari 1 hero yg smaa aja gk ketemu""",1
JANGAN NERF THARZZ 🥺😭😭,4
"game tolol, game yang kemenangannya bisa di atur sama adminnya, game rusak, game pengaturan skor..",2
monton asu,1
"blessing fokus kan ke sinergi yang udah Adah, gak usah ngasal yang lainn",2
untuk yang lain udh bagus si tpi tolong agar akun bisa di pisah dari mlnya jangan di satuin tmbahn fitur login ke akun² lain kaya fb google dst,5
aku sekarang sudah merasa lebih old karena aku main dari s1,5
sinyal lemot KLH Ama yg satunya,2
Pliss lah kurangin drak sistem nya tlol!,3
"server suka down, lag lag nggak jelas",4
gacha ampas,1
"Wkwkwkwkw gw udah ngerank, posisi ke-2, cape"" ngumpulin stak eru sampe 99. Tapi malah ga masuk history, alhasil rank pun ga naek. GAME KOCAG",1
"hapus fitur setelah kalah match mode spectator atau tambahkan fitur nonaktifkan nya, ngeselin sumpah bikin nge-frame hp bngsd.",1
aku kan loginn mlbb dan baca event skin gratisan nahh kan ada misi skin sepesial nahhl dan aku baca misinya di situu tertuliss capai rank warrior di MCGG nahh disitu aku dah capai rank elite tapi kok belum bisa di klaim,1
asikkkkkkk dan mantapppp,5
kenapa diskonec mulu dah ni game,3
kapan nih gold rush dibalikin lagi,4
gamenya terlalu boros memori jadi org yg hp nya kentang GK bisa main jadi saya mohon dari pihak game untuk mengurangkan data yang diperoleh dari hasil game,1
tingkatkan terus nanti nambah bintang lagi,4
"saat ditengah pertandingan terjadi eror yang membuat login kembali dan hero dari kartu pun berganti, setelah itu saat pertandingan berakhir pertandingan tidak terhitung padahal peringkat satu dan juga bintang tidak naik",1
"tolong di kasih fitur seperti mlbb, fitur yang bisa pakai jaringan wifi+data agar enak buat main.",3
"server lu benerin kocak, didalem game eror jaringan Mulu padahal ff ml lancar,juara 1 tapi ga naek bintang samsek apalah ancur buang² waktu",1
lagi maen tiba2 ada tulisan error... trus kluar sendiri... sekali masuk lagi kok udah kalah... padahal nyawa masih 80 an... trus story kalah nya gak masuk akal... udah jelas2 maen ape slot 9...kok d story nya slot 3...gak jelas... trus sekarang mau masuk gak bisa lagi... selalu stak d pertama mau mulai maen... udah nyampe 100...tetep stak d situ...,1
"jaringan gw bagus tiba"" DC jadinya gogo cardnya keganti trs matchnya itu gk kehitung. Hhhaawwwww",1
moonton tolonglah mode duo player ngasi ke temen jangan 1 kali doank donk gada batas donk monton . itu saja keritikan saya terima kasih,3
restart sendiri banyak bugg,1
ini kenapa ya kan pas main tiba tiba login ulang trus pertandingan nya udah selesai tapi ko saya masih loading ya,3
Kok bisa yaa saya kan menang ke 1 bukannya naik 4 bintang malah turun 4 bintang??? Coba bisa jelasin gaa buat developer Game Magic Gogo inia ???,1
"lucu yahh di mccg, kita menang no 1 malah bintangnya berkurang 🪷",1
keluar keliar sendiri saat bermain. updatean jelek,1
"selalu mengalami gangguan, pengalaman bermain kurang memuaskan, sering mengalami lag",1
"wehhhh erorrrr, jadi kurang bintang coyy kluar kluar sndiri abis tu match nya selesai sendiri, jadi -4 bintang aelah",1
"pas main game nya suka ngerelog sendiri, ada notif error tidak diketahui, trus pas login lagi, binta heronya keriset, equitmennya berubah, trus cardnya keganti sendiri",3
game ampas isi cheater semua,1
"game ngak jelas,jelas² hastag 1 malah mines anj 3b mana ke keluar² trus lagi karena error ngak jelas hadeh ngak jelas bat,rugi bat juara 1 malah mines 3b kalau bisa kirim foto udah gua ss dah",1
"pada tanggal hari ini, saya terkena pengalaman yang buruk di karenakan cheater tolong segera perbaiki masalah cheater ini. kronologi saya di posisi sudah menang dan tiba² disconnect karena eror tiba² ketika masuk lagi saya sudah ada di room dan ketika melihat riwayat saya suren di 7, padahal saya dalam posisi menang dan saya hanya menaruh dua Hero juga tidak ada player yang lain selain saya. tolong segera perbaiki masalah ini",1
"sudah dua kali kena bug di permainan rank, masa dapet peringkat satu tapi bintangnya minus 2, kacau sekali moonton ini",1
ngebug juara 1 bintang kaga nambah lagi koneksi eror,3
woy sering Nge bug pas main tiba tiba relog Trss,3
"sering muncul notif ""eror tidak diketahui, mohon coba lagi nanti """,3
ga jelas game apaan ini error pasti pertandingan item-item diganti semua ga jelas-ga jelas,1
mending di perbaiki lagi sering log out kalau pakai data,2
gw menang juara satu tapi malah turun 3 binatang ini gimana ceritanya harusnya naik 4 bintang tapi malah turun 3 bintang,1
untuk gemplay sekarang sangat bagus dan suda ada karakter lain nya sangat bagus dan saya sangat suka yg sekarang dari pada yg sebelumnya,5
"game ampas banyak eror, lag,hapus aja kek ampas",1
error keluar sendiri,1
gamenya sangatlah bagus,5
elor suka tiba2 aneh apdet GK ada aba2,3
setelah update gamenya ngebug,1
tolong Hero gold 1 di hapus aja,1
game aneh ada aja masalahnya kocag.,1
keluar mulu aplikasinya. malah lagi rank sudah begitu masa juara 1 dapat hanya 1 bintang makin ga Jelas,1
Game KONTOLLLL,1
game rusak relog relog terus gabisa maij ini gimana moonton player nya boleh main kaga?,1
apalah sempat² error apk ..,3
lagi enak2 main toba2 eror sistem bangke,1
"tidak nyaman bermain, gua 8 kali di reload padahal sedang menikmati permainan moga makin ambruk game nya",1
perbaiki bug error relog/menghubungkan kembali (kondisi jaringan bagus padahal) tambahin phase 2 token event skin mythical,2
"sistem nya sampah, aku udah pilih kartu yg bagus masa iya tiba tiba relog kartu nya ke ganti pepekla",1
"sementara main muncul pemberitahuan Error Tidak diketahui, Mohon coba lagi nanti",1
game tolol eror Mulu sinergi Udha jadi kejual semua,1
error gak jelas kocak keluar sendiri gembel,1
b1 dlu setiap match gue error melulu,1
server tolong diperbaiki bener² jelek sever nya,1
Saya menang mulu bintang5,5
"gak jelas masa modal 1 Hero harga 5 bintang 3 bisa kalahin combo 66, top ingame masuknya lama",1
"nerf nya makin parah,Jhony terutama,udah sinergi makin dipersulit,malah si Jhony yang d nerf. moonton waras? bakal balik lagi gak akalnya?",1
balikin commandar tharz kya dlu sekarang tharz comandar paling sampah,2
game ini bagus (bintang 5 ),5
jangan kebanyakan dark sistem...,2
terlalu leg pas awal masuk arena.tolong monton game ny di perbaiki lagi.,1
"tolong tambahkan mode lain seperti,duo yang nyawa nya di gabung jadi 1 dan tambahkan mode trio/squad agar lebih seru,,,,dan tolong tambahkan mode untuk seru seruan dan tambahkan beberapa sinergi kaya riders, Undead, abyss,angle, knight, Hero.",5
gg kata ilham,5
semakin lama semakin kaga bnr magic chess,1
"gem yang selalu membuat saya emosi , setiap saya mau main , selalu gem nya ngebug , udah saya mulai gem nya tetapi malah keluar lagi di suruh gas lagi , saya sangat emosi bermain di gem satu ini tolong di perbaiki gem nya supaya orang lain betah main di gem ini , tapi saya sudah hapus gem ini karena udah lever 43 saya main , dari lever 1 sampai sekarang ngebug selalu gem ,tolong di perbaiki , saya kasih bintang 1 karena saya tidak suka atas perilaku di gem , jaringan nya tolong di perbaiki",1
"Game aneh saya jadi korban entah itu bug sistem atau cheater dan tidak ada tindakan tegas dari developer, balasan customer service sangat lama, dan saya juga tidak mendapatkan kompensasi apapun setelah dirugikan",1
"hero nya pada chibi tapi aku ingin ada cici, novaria chibi.",5
nyari hero 1 aja susah nya kebangetan,1
GAME MATCH LAMA ORG DH RELA WAKTU NYA ABIS BUAT MAEN GAME LU GILIRAN MAIN DI KASI NYA GA SESUAI SYNERGI KONTL,1
mc bodoh game gak imbang,1
tolong hero frangko di hapus aja ngeselin tau,3
nerf moskov plis broken parah,1
"tambah parah sekarang,tambah ga jelas, combonya ga ada yg masuk akal,menang sekali kalah sepuluh kali,susah nyari hero yg dibutuhkan buat nyalain sinergi, minta saran hapus commander wan wan,Miya sama sinergi listrik sampah itu",1
"ga jelas, Nolan B3 kalah SMA argus B2, guwendenk",1
mantap main dari Synergy wermslayer ling unlimited ulti,5
BANYAK BUG,1
"game play bagus sih, cuman event tambahin. jangan ke ikut monton kikir",5
monton tambahin item star fall,5
game busuk.. banyak kecurangan nya,1
"kukasih bintang 3 dulu, untuk developer tolong banget perbaiki masalah sinyal error, padahal sebelum season 2 sinyal masi dibilang lancar ga ada masalah, tapi setelah update s2 masalah koneksi terus pas mau masuk game padahal sinyal bagus, bahkan untuk ganti akun saja tidak bisa karena kesalahan jaringan tolong banget di perbaiki secepatnya",3
"seru seruan aja,,,bukan pro player",5
"game taiii, wake bantug terus baang cicing",1
"maap aku ksih bntng 2 krna wktu MCGG d rilis smua nya ga ad masalah apa lg ke sinyal nya, tp smnjak d updte MCGG jdi ssh buat login pdhl jrngn aku baik baik ajaa udh d gnti pkai data seluler sama wifi ttp sma ssh sinyalnya, tlong lahh dprbaiki lagii sinyal nya jgn smpai mslh seple sprti ini bkl mngecewakan plyer yg mau main, dri segi gameplay udh bguss cmn sinyal jdi tolong dprbaiki lagi",2
game seruuu,5
Game nya bagus,5
GAME ANJEEENG KALO BIKIN CONANDER YANG NGOTAK BANGSAAAT MONTON BENERIN TUH JHONSON,1
Apalah game ini gw restart game malah suren bukanya nyambung lagi ke gamenya,1
"maaf mau tanya, kemarin saya main waktu s1 enak lancar dan aman, tapi semenjak update kemarin kenapa di saya waktu in game itu kaya frame/kualitas paling rendah, padahal paling tinggi dan coba saya turunkan malah parah, saya hapus donload ulang tetep sama aja gada perubahan, saya coba maen game MBLL,MLA, WoR semua aman loh ga frame dan itupun pake yang paling kanan kualitasnya",2
gem ini sudah cukup menarik untuk saya dan dari segi permainan itu juga lumayan bagus dibanding dulu,4
"sinyal jumping mulu game aneh, padahal sinyal lancar, bikin gak mod main.",1
grafiknya jadi kurung sama yang lama,4
"woi hapus commander jongson dari game ini, perusak meta",1
"Sama spt ML ,sama2 game anjeng game baby",1
makin kesini makin ga jelas naek legen aja susah ada aja halangan hero sering gadikasih lah aitem jelek semua lah kaga jelas skip,1
"suaranya.. kadang2"" hilang, jaringan GK stabil",2
kasih bintang 2aja gaem nya jelek lag trus setiap main,2
kocak update terbaru,1
"game sampah, roll tidak dapat-dapat yang dicari. Aneh. Sinergi tidak seimbang. Sunggu mengecewakan!",1
"game sempak habis update pembagian Hero, item kaga jelas, moskov jadi tier Hero ter-OP, yuzhong jadi Hero 5star gak guna, apalagi pas last game jelas-jelas Hero masih banyak di shop tapi sampe coin habis tetep gak dikasih tu hero 😀",1
"habis update kemarin kok jd gk jelas, kalo hoki hero bintang 5 di slot 8 udh pada muncul, klo apes di slot 9 ae susah bet dapat hero bintang 5,gw main sisen kemarin sampek mitic 22 sekarang boro"" ke mitic naik ke legend ae susah bet , jaringan ya kayak j*mb*ttt kusut bet , wifi oke jaringan data Telkomsel gk ngaruh tetep lag, entah lag atau bag ganggu bet apa lagi pas milih kartu atau pas ambil box , lag dah kelar dapat yg ampas""",3
kemampuan commandernya ga adil seperti wanwan lebih di untungkan,1
gangguan terus ngga beres.. tiap kali gameplay gangguan,2
maen enak dulu skrng di persulit enak kembali ML lagi,1
knpa sering ngleg. tolong perbaiki,1
"sinyal gk jelas selalu muter2 gk jelas, padahal sinyal lancar, gw pancing yutuban GK ada kendala, balik lagi ke mcgg malah GK waras, gimana mau menang klo mcgg sinyal burik",1
nice bang monton,5
"game bikin emosi, game nya enak yg dulu, ini main padahal pake wifi dan Wifi-nya lancar tapi gamenya ngelaq menghubungkan mulu, game rusak kalo update itu harusnya menuju yg lebih bagus ini malah bikin emosi tambah jelek",1
"sekarang kalau hp tinggal sedikit pasti kalah meskipun kalau di lihat gero sama damage lebih gede tetep aja kalah, ga bisa comeback sama sekali",1
parah setiap abis updet eror gabisa gerakin hero.. sama skali... klo memang HP ny knapa yang lain lancar cuma pas match mulai hero gabisa di gerakin payah payah gua hapus juga nih mc gog gog,1
"gk paham ama ini game. dr epic naik ke legend. pas di legend posisi di ranked legend XI terus kita menang sampai di legend V. gw bingung kok menang bukan naik malah turun gt. eh yg kocak ud legend V kirain menang langsung k mhytic ini malah balik k legend IV lg. apaan coba,,, asli gk ngerti gw. emang legend skrg ampe 10 gt? auto delete game. buang2 waktu",1
"rusak nih game, kesalahan jaringan Mulu padahal jaringan bagus, lumayan banyak juga yg rating b1",1
nerf moskov blog atau ga hpus aja,1
pls dong update biar gak susah heronya sering stuck dan kalau pengen menang tu hoki hokian pls sistemnya diperbaiki biar sportif semua dibagi sama ratakan susah setelah update cari heronya,1
sistem gacha Hero nya goblok.,1
"game sudah sangat bagus,tapi yang buat kesal selalu lag dan tiba-tiba ketika di dalam permainan langsung restart,lagi nyaman pilih hero tiba-tiba keluar,padahal jaringan saya 4G bagus,tapi kenapa selalu lag,, ayo dong perbaiki,masalah jaringannya",1
"Tolong devoloper di kurangin dikit data data nya kasihan buat yang hp ram kecil nya seperti saya ini dan ada masalah lagi tentang SINYAL/SERVER padahal sinyal nya bagus pake wifi tapi tetep aja gabisa main,setiap PERTANDINGAN DI TEMUKAN tiba-tiba ngestak jadi gabisa di mainkan terima kasih",3
kurang in dark sistem nya bos,5
ngelag ngebug !!!,2
"game nya bagus, tapi Tolong kedepannya untuk mode custom tidak perlu pakai data lagi, terus tolong tambahin mode offline dong",5
oke sudah keren maksimal,5
"megic cheas go go sekarang makin parah ngebuk Mulu kalo main, padahal pertandingan nya sudah selesai malah kembali bertanding lagi",1
"tolong solusinya buat player yang ngechet,tadi pas main padahal juara satu tau tau close game sendiri dan jadi peringkat 3 player yang main cuma 7 padahal d awal 8 dan ga ada histori pertandingan,ini kalo bisa kirim file sudah ku kirim screenshotnya tadi",5
"perbaiki bug nya, saya harus nya juara 1 malah jadi juara 6",1
"udah oke, tinggal slot nya aja tambahin jangan empat, ya minimal lima lah",5
"saat bermain rank dan menang peringkat pertama, ketika pertandingan selesai ada note eror lalu keluar aplikasi sendiri, setelah masuk kembali seharusnya naik bintang ini malah turun bintang nya nohon penjelasan nya🙏",2
tolong dong magic chess menjadi game offline plis jadi biar rame yang dowload,1
game gaje ngelag sendiri woi perbaiki napa,1
b aja gak ada bagusnya,1
seru banget game iniapalagi main bersama teman,5
pliss lah waktunya diperlama udah dpt 10 eruditio lgsg kalah,3
gua menang bntang ga nambah gimana ini montoonnnnn,5
"moonton kalo dikit lagi bintak tiga tolong jagn di persulit ,..",5
"game eror mulu, harusnya peringkat 1 malah jadi ke 7, malah turun bintang. tolong perbaiki bug eror ini, game gak jelas",1
bagus sih game nya tapi sering ngeleg terus muncul error padahal mau menang bintang segini dulu kalo udah diperbaiki baru bintang 5,2
"di bawah tier mytic saya sering banget kena bug ini, misal saya pake comander bintang 3, otomatis musuh juga pasti comander bintang 3, disini masalahnya tiba tiba ada 1 musuh yang comander nya ga bintang 3, 1 orang ini pakai comander bintang 2/1 , di awal game nya masi lancar kaya main biasa, tapi tiba tiba pas mau menang game nya keluar sendiri ke loby, dan disitu pas saya cek di history, history nya tidak sama seperti game tadi, tapi nickname dari semua musuh sama",1
