content,score
game aneh sial. sulit dapat heronya sedangkan musuh mudah dapat kan heronya. jangan dowload game ini no recommend banget maen nya.,1
gak seru kalo gak satu app sama moba.,5
"tolong dong sinerginya di sesuai in semua biar rata damage nya, kaya mage ini damagenya kurang bgt padahal dulu itu setara sama sinergi lainnya, tiba² patch sekarang malah turun drastis kaya gak guna",4
"ga usa didownload game keluaran MONTOON.ga ada yang bagus game keluaraan MONTOON.yang ada kalah terus.kasi ulasan buruk biar dihapus dari play store.bagus lu main HONOR OF KING. ga ad make editan sistem kek game keluaran MONTOON.kita merepot player buruk langsung dikenain sanksi di HONOR OF KING.ga kek game MONTOON,ga ada respon.",1
ga bisa login suka ngelag ngelag tolong segera di perbaiki padahal sinyal bagus tapi ga bisa login udh setengah jam nunggu tapi tetep ga bisa tolong perbaiki game nya menurut saya game nya udh bagus saya suka tapi kenapa ngelag banget saya sangat kecewa mudah mudahan game nya segera di perbaiki,1
game scam game ga masuk akal game ga sehat....,1
"dipermainkan sama sistem.... gamenya jadi membosankan, semoga lekas sembuh....",1
"asik cuy, tapi lama gamenya sekitar 25 menitan (kalau peringkat 3-1) seru!",5
memuaskan,5
"moonton, thank you. akhirnya magic chess lama di adain lagi. elementalist come back 😍",5
"baru masuk rank legend,susahnya minta ampun buat nge push,tapi itu yang bikin seru jadi ada tantangan lebih",5
"Kenapa harus di pisahin aplikasi magic chess dan aplikasi mobile legend , malah makin ribet sekarang kalo mau main magic chess jadi 2 aplikasi ... tolong lah satukan lagi aplikasi nya magic chess ada di aplikasi mobile legend jangan di pisah-pisah jadi 2 aplikasi !!! Semenjak sistem season semakin hari semakin buruk dalam warna hero nya tidak seperti 10 dimensi !! burik pokonya bagus ,sekarang semakin burik dari hero nya juga !!!",1
"game tolol ling b3 kalah sama badang b3 gk masuk akal,sampah",1
gem gak jelas,1
"ini kenapa ya sekarang malah sering ngelag/dan terlalu sering muncul menghubungkan kembali padahal maen mobile legends jaringan normal"" aja",5
moonton coba Ling di buff kaya gini(setiap mengeliminasi lawan di dalam ring akan meng copy hero yg berada dalam ring),5
Game idiot laneup bagus masa kalah,1
"Habis update mlh jadi gajelas, susah banget buat ngedapetin hero yg sama buat naikin bintang",1
"gak kyak dulu, gak asik",1
"mohon untuk Hero wanwan untuk di nerf skilnya,meresahkan Gunawan ini",1
permainannya ngelag terus burik,1
yang ku mau di magic chess go go ada mode full party lima vs lima lalu aku maui ada beberapa Hero di mobile legends yang seharusnya ada di magic chess buatkan system top global setiap Commander,5
Karena mudah saja untuk menaikkan level tertinggi dari Hero,5
sering nge lag,1
"jaringan bagus, pas main lag parah",1
ngelag Mulu....padahal sinyal udh 5g masih aja ngelag,1
ping jelek ga sebagus ml walaupun jaringannya device stabil,1
MIN HADIAH BP YANG DI MCGG SETIAP KITA SELESAI MAIN MASUKIN KE AKUN MLBB LAGI DONG KAYA DULU,1
grafik jelek,1
"min boleh kasih masukan gak, gimana kalo di profile game kasih commander favorit seperti ml,kayak jumlah pertandingannyan wr nya, Ama kasih jg title commander min , terimakasih",5
"apaan ini ga bisa login, interface ml bahkan di ml tdk bisa ganti akun moonton, perbaiki",1
apk nya bagus strategi nya juga banyak tapi permasalahannya di download data udah selesai semua dan ya yang udah kedownlod hilang seketika saran ya untuk pihak developer nya untuk memperbaiki masalah ini segera sekian dari saya terimakasih,3
makin ga jelas,1
tolong jaringan diperbarui lahh...ini game besar loh...yutub lancar main game ini bapuk...,1
"ini game sangat cocok untuk orang yang dulu nya cuma main magic cess di mobile legends, dan sekarang bisa download terpisah agar bisa menghemat ruang penyimpanan",5
aku beri bintang 5 karna seru banget,5
"game nya udah baguss tapi tolong dong kasik tambahan sedikit waktu pas sebelum warr biar kita bisa mikir lebih lama , terkadang belum kasik aitem udah di mulaii tolong dong di perbaiki",5
tidak ada yang bisa rumah 🏡 Ki u,3
"Setelah update server makin jelek buffering trus, Hero yg diberikan ga sesuai dari gogo card.",1
No comment udh bagus soalnya,5
magic chess go go Sangat seru mainnya bisa mabar Dan kayak main Catur😉😉 gabung gabung hero,5
game lol,1
tolong bukan mode offline seperti MLBB 🙏🙏🙏🙏🙏🙏,5
"saya suka Mobile legend, tp lebih suka magic chess.. lucu aja g begitu memerlukan emosi.. jadi mengurangi dosa untuk tidak berkata kasar.. hahaha..",5
bagus sih tapi.. kenapa harus pisah aplikasi woilah moonton kan jadi ribet 😭😭👊,5
Mohon untuk developer magic chess beri peringatan untuk comander tharz saat tidak sengaja menekan tombol skill tharz agar memudahkan Player aku akan memberi bintang 5 jika peryataanku terwujud karena kejadian tadi aku reflek mencet skill tharz padahal mau buka go go card makanya aku ingin ada fitur peringatan pls 🙏,3
saya tidak bisa menginstal aplikasi ini kenapa? coba anda perbaiki lagi,1
"udah bagus, cuma berasa jomplang banget harga up level mehoong kalo dibanding mc old. mode nostalgia masukin fitur skill hero nostalgia juga seru kayanya, contoh skill ling 1 ling 2 & 3",5
sinyal nnya di perbaiki lah tolong main game ini,1
"drop rate hero yg di butuhkan terlalu tidak jelas,,level com 8 bintang 4 aja minimal butuh 30-50gold cuman dapet 1 hero, ini game RPG apa game adu HOKY..?? apa gk bikin game slot aja ini developer kalo adu hoky segala,,",1
very good,5
bisa sambil nongkrong,5
kocak amat ini game bisa make cit bjir aowkwkwkwk,1
"Kembalikan magic case yang dulu, skarang magic case hanya bergantung buku buff yang di dapat & comender, sinergy sudah tidak terlalu berpengaruh, sinergy make era, cadia, dragon altar & abys sinergy andalan gw di ilangin 😭",1
"udah gak jelas lagi magic chess udah gak sama kayak dulu lagi , masak apha Hero 5 gold kalah sama Ling Hero 4 gold padahal bintang nya sama bintang 🌟🌟 build nya juga sama di Tarok sama lawan , tapi tetap aja apla kalah sama link , dan ada lagi Hanabi bintang 🌟🌟🌟 masak kalah sama wanwan bintang 🌟🌟🌟 padahal kan Hanabi kalo di jual dia Hero mahal juga termasuk Hero sakit , tetapi wanwan Hero 1 gold kan gak sakit , tolong kedepan nya di perbaiki lagi supaya orang lain enak betah main di gem",2
"perfect sih asik asik aja, banyak player yang kangen mode nostalgia skrng udh di rilis, kalau player ngeyel kangen kangen mulu biarin dah di semua game pasti selalu kangen moment nostalgia jaman old apapun itu game nya, mcgg juga kayaknya masih belum jelas ini moonton mau gimanain😂, yang penting asik dah.. yang kurang itu fitur skill comander nya tuh 1 doang jir terus adain kayak clan/squad gitu, lebih bagus bikin pake magic coin aja biar gausah topup cuma buat bikin squad☹️😂",5
kedua nick name ini tukang nge troll merugikan player Lain yg solo Rank mereka Duo Troll ™TAHU_GHODOK!!! dan ZuperZenaEx99,1
comander Yuki di hapus aja sama Kagura montoon ah,2
sering ada sinergi ultra tapi computer ambil kon###,1
karna ridak bisa di dowload di hp ram 2,1
"Sisa satu match tiba-tiba lah gak bisa di pencet, anehh",1
tolong tambahin bisa atur hapus unduh di manajemen konten makasih,4
"MC sekarang gak jelas heronya, gak kaya dulu nyari heronya gampang gak kaya sekarang, nyari hero sampe lategame pun gak dapat, kecewa sama MC sekarang",1
"suka bug padahal hero pas dan dapat sinergi nya malah g aktif kehitung 10 malah ttep 7 tolong laa di perbaiki moonton, dan itu g terjdi sekali terjadi sampai 4-5",1
sistemnya ga jelas,1
bagus addict,5
"tolong diperbaiki lagi untuk dibagian notifikasi saat lag,sudah stabil masih ada notif,tidak bisa hilang dipaksa login kembali dan tidak bisa masuk ke dalam pertandingan kembali",3
"banyak bug dan patah"" saat main, ada sebuah bug , lebih suka saat digabung dg mlbb, sulit mendapatkan hero yg di dapat, kadang rank tak sesuai dg lawan.",1
monton ..9 eruditio kurang Jony aja nggak di kasih🤮🤮,1
"tolong tambahkan fitur unduh replay di dalam game, untuk mempermudah konten creator dalam pembuatan kontennya. terimakasih, mohon dipertimbangkan",5
Gameplay aneh,1
kurang menarik,2
untuk update makin kedepan makin bagus tapi setiap di akun aku setiap update ada bug chat dr ml pesan sudah dibaca berulang kali namun masih ada tanda dl dah lapor cs dah di benerin tapi sekarang habis update muncul lagi. saran fitur tambahan bikin fitur album sama praundang ini menurut ku penting banget,4
"roll hero busuk, demek hero tumpang tindih masak b3 gold 4 hero bisa kalah dengan B2 hero gold 2 pdahal sama sama full EQ",1
biarkan saya bermain Magic Chess,5
"untuk game play dan fitur fiturnya saya rasa sudah cukup baik dan memuasakan tetapi yang menjadi keluhan saya, kenapa saat matchmaking itu selalu reload terus dan itu terjadi berkali kali akhirnya saya harus login berkali kali itu sangat menggangu akhirnya saya tidak bisa optimal dari bermain yang berakhir kekalahan karena mengulang ngulang login padahal untuk divice hp saya sudah sangat mendukung",3
Tolong dong ini game jangan di pindah pindahin ribet bjer 🗿,4
rusak seharusnya awal milih Hero sama sinergi biar ga tabrakan semua,2
padahal sinyal nya bagus tapi di gem nya leg terus tolong di perbaiki ya,3
game seru dan menegangkan,1
okela,5
𝙜𝙖𝙢𝙚 𝙩𝙚𝙧𝙗𝙖𝙞𝙠 𝙞𝙣𝙞 𝙢𝙖𝙠𝙖𝙨𝙞𝙝 𝙢𝙤𝙤𝙣𝙩𝙤𝙣𝙣 👋,5
bagus benar,5
Bagus buat orang yang udah stres lose trik di mobile Legends mantap moonton👍,5
game nya bagus tapi sedikit lol di login akun kadang eror,3
"tau ini dari temen yang ""magic ches lucu2 """,5
"makin di update makin berat, buat apa di pisah kalo sama aja berat",2
blacsecren:),1
ngeprank 😌,3
lu pada main kek gini tmbah goblok lama lama game kaya slottt menang sekali kalah ribuan kali,1
gajelas,2
download data Mulu anjir,1
"game hebat, gw dikasih sinergi 10 mulu. game favorit. otw jadi game nomor 1 di dunia, bisa mengasah otak. seharusnya game ini bisa mengalahkan game sebelah yang MOBA banyak Jawa. dan tolong buat turnamen MC Gogo versus catur. dan tolong nerf Uranus Titan gw Susah lawan. dan tolong permudah mendapatkan sinergi 10 eruditio dan 10 ember lord. dan tolong nerf astro serta nerf vexana dan tambahkan mode 4 vs 1 sekian eh dan buat Johnson kecil seperti dulu lagi dan batalkan rilis commander Karina",5
tambah gabut,5
sangat bagus dan sangat menyenangkan,5
kartu saya ampas,4
gamenya sangat seru,5
setelah diinstal ulang masuk pke akun malah hilang koneksi terus download data lama dan tidak bisa dimainkan dihp baru saya kira ada sinyal eh malah lag nya parah,1
game celekkkk,1
anj sinyale ngeleg ngeleg,2
"dulu gue yang nyaranin magic chess di pisah waktu hp gue masih lemot. sekarang beneran di pisah. ternyata bukan gamenya yang salah,gue yang terlalu miskin tapi terima kasih sih. tetap magic chess yang terbaik. cuman nyaranin gamenya seimbang Hero harga 5 gold harus bisa di kalahin lah sama full sinergi GK ada perlawanan kalau dah jadi. jadi malas main skill commendernya GK seru mending kek yang dulu",1
Game terlalu susah untuk orang yang sulit fokus. karena setiap bisa sinergi di MCGG selalu update ganti sinergi² terbaru,2
maksa di kasih bintang,4
kebanyakan event buat klaim event aja sering ngebug,1
"perbaiki servermu, lag banget.... pengalaman bermain buruk karena server yang lag",1
boleh,5
yaaa alasannya awal awal ga susah kek mlbb lah atau gw aja yang ga bisa main mlbb🗿,5
tolong buka mode practice untuk semua player,4
gamenya jelek bgt skarang,1
"Dear untuk mimin, tolong nostalgia mode era ling era star core kami merindukan masa itu jangan cuma mode rune min!!!",5
"Cristal astro tiadakan, menganggu gameplay & damage!",3
mengapa game ini tidak bisa di download,1
"usahakan download data tuh bisa di tunda,bisa lewat wifi aja kayak MLBB",2
permainan ini bagus yang hapus pasti nyesel,5
"game taik,",1
Jaringan Jelek,1
game aneh kok gua gak pernah hoki oy madai #8 4 kali aneh gua apus dulu 😩😩,1
saya usulkan mc mode old di pertahankan aja,5
"game strategi butuh kepintaran, gk cuman taruh Hero trus udh, harus ada strategi yg bisa bikin Lane up lebih kuat, cuman kukasih bintang 4 karna sering ngelag",4
"game nya udah bagus min,tapi tolong buat gw yg baru download gaush ad tutorial paksa nya gw mau ganti akun juga lama ngabisin waktu min.itu aja makasih.",5
"apasi lagi main tiba tiba koneksi lost, padahal wifi lancar buat aplikasi lain, terus juga suaranya hilang padahal musik suara dalam game dll full di 100 tapi ttp aja ilang, udah si uninstall kalo gini banyak kendala padahal cuma buat have fun main game",1
byk bug,1
"Plin plan, kebanyakan pembaruan patch, bikin ga nyaman",1
nerf hero roll bawah,3
"gua lebih suka yg dulu, udah itu aja titik",2
gacorrrr,5
game ini sangat cocok bagi anda semua untuk game online terbaru game online game flash player terbaru industri di Indonesia,5
"sebelum meluncurkan patch terbaru sebaiknya di cross cek lagi. Kalau mau memberikan buff atau nerf ke Hero atau synergi, perlu di uji coba lagi. Contoh, sinergi MM, di nerf parah. Padahal Hero seperti Layla, wanwan, Clint dan Granger tak ada damage nya alias geli geli aja kecuali irithel dam moskov. Harusnya yg di nerf itu Hero irithel dan moscov saja, jangan Sinergi MM secara keseluruhan yang di nerf😡😡😡",2
gem bagus saya belum ada dua hari Udah master pokok nya bagus lahh🤓🤓😉👍,5
rune cristak kek sistem nya gk adil dameg hero nya gk ngotak lah,1
"update bukanya makin seru malah makin tolol,",1
perhitungan banned tidak masuk akal. seharusnya perhitungan terbanyak dong.,3
jujur saya suka game nya . yg saya gak suka setelah updte masa saya full level 11 hero full bintang 3 ..kalah sama mokov bintang 1/2 ngakak kesenjangan yg sangat jauh tapi musuh menang cuma gara2 moskov level 1/2,2
nama game nya jangan ada kata GO GO!!,4
"di bandingkan MLBB game ini sering susah dibuka, sering ada bug ketika mencari pemain dan di beberapa situasi tertentu hero yang di harapkan muncul cenderung di sembunyikan dan tidak di munculkan",1
hapus aja dari playstor game sampah hapus hapus hapuuuuus,1
Game gaje 70 persen hoki 30 pesen skil kadang suka ngeleg perbaiki lah MOOONTOON,1
tolong ada opsi unduh yang penting saja sebagai opsi dan gak bisa di jeda pengunduhan ngapain ada pengelola unduhan kalau gak bisa di stop,1
"Akun udh mytic gara2 ganti aku terus maj ganti lagi ke akun sebelumnya sehabis verifikasi kode muncul tulisan network conetion error please try agin muncul itu terus jdi gak bisa nerima kode dan ganti akun sudah hampir 1 bulan dan gonta ganti jaringan wifi data gitu terus padahal coba di hp adek ku bisa, al hasil aku hpus game nya game broken",1
"menurut gw gausah cape cape bikin game yang lainn ML aja masih rusak, seperti player solo di pertemukan dengan player bucin,Mabar,dan Dll, dan player yang main tidak benar seperti mencuci baf,tidak ikut war,tidak membantu tim yang lain, itu tidak bisa di laporkan/report saran, mending perbaiki lagi di bagian pencarian tim pas matching player solo di pertemukan dengan player solo lagi, dan player yang ugal-ugalan bisa di report tidak hanya player afk yang bisa di report player yang ugal-ugalan",1
lumayan seru tapi jangan dimainkan untuk hp ram kecil,5
bug Jonny tidak mau nabrak,1
"sebenernya game ini si bagus "" aj tapi minusnya refresh tokonya keseringan ampas",4
game seruu mudah,5
hapus aja game gaje,1
"gua naikin bintang nya. Tapi kenapa server nya down setiap gw mainin, sedangkan Abang nya (MLBB) itu bagus? tolong ya",2
parah seting banget lag server nya,1
gam sangat susah,1
tingkatkan lagi,1
seruuuu,5
sangat menggairahkan interest,5
"pemilihan hero + item, seperti bermain judi, jadi bisa disetting kalah, dengan cara dapat kartu go go jelek dan hero murah terus walaupun sudah dilevel 7/8, mending sistem beli seperti Mobile legend, jadi lebih adil",1
mahices lama,5
tolong di buat kan juga untuk mode offline agar bisa melakukan eksperimen² dan melatih keterampilan dan untuk mode custom vs Ai tidak mengunakan internet seperti halnya mlbb,5
rekomendasi buat yg lagi sakit,5
game rusak produk moonton emang rusak bikin stress game penambah stress,1
"sebelum mcgg diliris kirain hero yang diingkan itu gak sesulit pas masih satu apk sama mlbb ternyata sama ajah, mau dapetin Hero sesuai emblem sangat2 sulit, malah kalah paling bawah terus",1
makin rank tinggi makin sulit buat dapatin Hero bintang 3,1
nerf tu sinergi downbreker dan Aurora koncet ga belence 🐶,1
sekarang banyak eror masa enga bisa masuk,5
"min skill comender di balikin seperti dlu min,karna ini ad MC nostalgia gw pengn comender ny juga di nostalgia in juga min dan gw ngsih bintang 4 krna kurng 1 itu aja 🙏",4
skin comender sama semua kayak skin aslinya Ngak ada perubahan bosan liat nya,1
cocok banget buat aku yang sering sering stres main main game mobanya banyak dark sistem jaringan sering ngeleg di game ini setidaknya bisa menghibur lah dari stres ku thank you,5
"Kenapa tidak ada fitur untuk magic chass go go di live tiktok, tidak seperti mobile legends yang langsung tertuju ke game saat live di tiktok?",3
loding terus ga bisa maen,1
"kasih lawan yang sepadan monton,butuh draksistem ini gue",5
kenapa ketika saya main di kasih yang jelek trus😭😭 saya jadi kalah muluu hahh....gimana sih harusnya adil dong...yang lainnya dikasih hero bagus kecuali gw... gw aja dikasih yang jelek dan gak sesuai,1
Cocok buat yang bosen main ml,5
"gems ga jelas masa gems gitu doang ram 4 bisa bunyi kaya mesin cukur, kalo buat gems tuh di turunin ram nya biar rame tolllloooollllllll",1
sering keluar2 sendiri,1
game sekem 😑😑😑😑plis lah jgn sekem muntun,1
benerin dulu game sebelah baru bikin game baru,1
"Tiba"" menghilangkan gbs di mainin, login ulang trs bisa, udh ny menggunakan lagi. padahal sinyal aman buka aplikasi lain lancar kocak",1
sinyal lost,1
"masih banyak cheater, main udh mau menang eh sinyal tiba2 muter, harus di pksa reload. Beberapa kali menemukan hal seperti itu, terutama bertemu yg katanya top global tapi cheat",2
"Tolong kalo gak niat bikin game gak usah bikin game, masa lagi war udah win streak dari awal musuh tinggal 1 malah server eror yang jelas lah kalo bikin game, pakek di buat apk sendiri lagi, masih enakan jadi satu di mobile legend gak pernah eror server, montoon"" hadehhh...",1
Tolong lebih bijak lagi dan perbaiki kendala seperti jaringan menghubungkan ulang saat bermain. padahal sinyal saya baik-baik saja.,1
"sering lag gajelas,",2
kalau maintenance itu diberitahukan jangan tiba tiba lagi main dibuat ngelag buat tusun aja,1
jaringgan server sering eror membuat bermain tidak nyaman dan sering mengalami kekalahan,1
sering disconect sekarang,1
sinyal bagus ngeleg di pertengahan pertandingan mulu asw,5
"sering banget tiba tiba menghubungkan ulang, padahal wifi aman, giliran login ulang ngestuck gabisa masuk, tapi buat yang laen laen bisa",3
"ayolah moonton kenapa sebelum atau sesudah fatebox pertama sering lag koneksi buruk, ini tidak terjadi sekali tapi beberapa kali di kondisi yang sama, jika satu kali atau dua kali wajarlah mungkin karena internet saya yang buruk, tetapi ini terjadi beberapa kali di kondisi dan situasi yang sama",1
"sering "" menghubungkan jaringan "" waktu di dalam game posisi jaringan bagus wifi/ seluler ga ad masalah, kalo bisa di perbaiki permasalahan di sana",3
ga jelas menghubungkan terus mana relog gak bisa masuk lagi!! game rusak.,2
"TOLONG DIPERBAIKI KALAU WAR TINGGAL 3 BESAR TIBA"" NGELAG, MASUK LAGI UDAH SELESAI DAN RIWAYAT NYA PUN GK ADA KOCAKKKKKK",1
sering lag padahal jaringan lancar,2
"kalau sementara bermain jangan tiba tiba pembaruan laa moonton, jadi gangguan server kirain jaringan ilang padahal tidak.",2
"game rusak, server ngelag",1
makin ksini makin gajelas kebanyakan maintance bug jaringan..,1
game aneh sinyal bagus tapi lag kocak,1
NAJIS TERUS SAJA MENGHUBUNGKAN !!!,1
tiba2 ngelag pdhal sinyal full,1
sering DC di game padaha koneksi aman di browser / streaming video,3
game gajelas. sinyal full kok tiba tiba tidak ada jaringan,1
"tiba2 hilang sinyal,dan bukan sekali dua kali,padahal internetan,youtuban lancar",1
"gblok benerin bug nya dulu baru buat geme maen tiba"" keluar padahal jaringan lancar dongo",2
game tolol ngelag,1
sering lag ga jelas,1
dongo sinyalnya ilang ilangan,1
Tolong di perbaiki server karena stack pemberitahuan hilang jaringan padahal jaringan penuh,2
"anehh sinyal bagus tapi menghubungkan ulang Mulu pas udah ws 3x aneh emangg, gitu ya caranya biar ws pecah",1
game ga bener ngestak mulu lagi main sinyal padahal aman minimal di perbaiki lah,1
game rusak sering banget ganguan sinyal padahal wafi amn buka yg lain lancar jaya giliran push MC gogo DC KLO ga menghubungkan pas di game nya ajg 2,2
"game nya main gambling, kalo dapet hero nya kembar enak, kalo ga ga enak",1
"GAMENYA SERU tapi sayang masih banyak yg pake cheat,tolong di perbaiki monton 😮‍💨",5
"Tiba tiba aja disconect tanpa sebab, jaringan full bar gak ada kendala eh disconect sendiri, syukur"" bisa nyambung ke game, lah ini parah gak bisa connect lagi ke game terus dikasih pelanggaran + bintang turun. heheheh ton moonton, good work! 👍👍👍👍👍👍👍👍👍👍👍👍👍👍",1
"lag, gak jelas. koneksi lancar tp in game menghubungkan",1
tolong server perbaiki mass tiba2 reconect ga jelas lagi. hrus login ulang baru jalan!!,3
"game eror, masak iya main tiba2 lag, bukan karna internet looooolll",1
"game sampah di late game mau menang aja di persulit dengan tiba-tiba reconnect, pdhal internet aman aja, bintang 1 game sampah",1
kenapa sering eror lagi main enk enk tiba tiba leg satu server gerammm,3
BANYAK BUG. BUG TERDIRI DARI: 1. JARINGAN 2. GAMEPLAY 3. JARINGAN 4. GAMEPLAY 5. BALIK LAGI DARI AWAL,1
"adanya kecurangan bermain saat permainan tiba"" koneksi hilang padahal koneksi saya kenceng dan coba menggunakan wifi juga sama, tolong dibantu memberantasi kecurangan yang ada",1
"game gak jelas, sudah double jaringan, data dan wifi 50mpbs masih ngelag, percuma pisah aplikasi, tapi gak jelas juga proses perbaikannya",1
ga jelas banget lagi main tiba tiba server down,1
ngeleg,1
jaringan ngilang2 terus padahal internet stabil. mana lagi kritis jadi kalah. koplokkk ini game,1
late game malah relog pie to ki?,3
"sistem game sering eror jaringan bagus tiba"" jaringan menghubungkan ulang",2
"taik bisa2nya ada yang make cheat tiba2 konek putus, keluar game masuk lagi malah gak bsa",1
woi knp tiba tiba lag,1
FUNGSI WANWAN APA BOSS?,1
game najis mending AOV,1
tiap main ga dikasih hero yg saya butuhkan ngakak cik,1
kembalikan sinergi yang lama!,5
keren aja ajay pppopp jik ada yang mebca ini mabar reng mitik imo gedong ml,5
Bagus aku suka kekuranganya buat aku kalok pasupdet kasih Hero baru,5
dear moonton tolong kembalikan sinergi stun ku mohonnn,4
game burikk.,1
game paling buruk wkkwkw sumpah buruk bgt. lama kelamaan ini di tinggal player nya ini. gw main MC dari dulu lama bgt. pas di pisah jadi aneh . asli paling buruk ini game .,1
katanya sinergi seperti MC old padahal masih beda jauh sempat download pas baca 5 menit main ceh sinergi langsung hapus apalagi tau ada gogocard nya sama game nya kaku gk kayak MC ORI ini kayak sampah gak ada pertarungan taktik sedikit pun kayak dulu bisa experimen asik ini kayak AJG UDAH SKIL COMANDERNYA ANEH BANGET AUSTUS SAMA THARZ JUGA GK ADA GAME APAAN SCAMM😡,1
Ilangin fitur pas kalah kenapa harus liat orang lain maen,1
mc gogo ini lebih seru dari game lain,5
"game nya bagus, tapi tolong hero gord di nerf karna damage nya gak ngotak",3
game tidak baik untuk anak kecil bikin pusing ngescam,1
"aneh semenjak aplikasi pisah sama mlbb, mlgogo ini suka susah banget login buat masuk udah berapa kali uninstall tetap aja.. jaringan udah bagus coba wifi sama aja.. enakan gabung sama aplikasi mlbb seperti seblmnya.",1
setelah di update jadi stuck loading di awal game parah sih,1
"Game scam, trash game",1
Keren Dan Menarik Game Nya Tetapi Fitur Fitur Nya Masih Kurang Untuk Pemain Yang Sudah Lama Bermain,5
kerja bagus,5
susah untuk dpt kan sinergi yng tepat... tingkat warior aja susah nya minta ampun,1
"overal bagus. tapi ngak bisa ngeliat profil orang 🗿. masak ngeliat profil harus follow dulu. iya kalok orangnya asik, kalok songong. 🗿🗿🗿",5
"MENANG KALAH diatur sistem, kalau lagi lostreak langsung gampang banget menangnya. tapi pas winstrik mau pakai cara apapun tetepusuh diunggulkan dengan kartu & shop yg sinkron. intinya INI BUKAN GAME STATEGI, TAPI GAME ""HOKI"". -pas kalah level 9 stock hero 14/15 rolling sampai habis 40gold gak keluar'' heronya -pas menang lvl 7 roll 3x langsung bintang 2 hero epicnya anehh",1
makin gajelas dari segi apapun gajelas !!! sampah!!,1
Game seru,5
sumpah mendapatkan kemenangan di magic crystal rune susah banget menang nya saran ubah lagi kaya di mcbb ori nya susah buat dapet rune nya susah lah kalah mulu gara² musuh yang dapet duluan,3
round creep item nya ga keluar ... baru muncul setelah fatebox,1
jgn mau ntr di bantai,5
Game gendeng(kikir dikit),1
game ini sangat bagus and bisa di mainkan di waktu saat sedang bersantai. (good game),5
"UBAH ULTI THAMUZ, GAK GUNA ULTINYA BJG",2
makin di update malah makin buruk jelek gamenya gk asik,1
jelek banget,1
makasih banget udah nyedia in lagi mc yang dlu,5
"benerin server lu dulu baru pembaruan,ngeleg Mulu pas main pas streaming aman aja",2
"nerf karina coy, ga ngotak imunnya",2
semuanya sudah Bagus tapi masalah jaringannya tolong di perbaiki padahal jaringn ku bagus 4G hp iponb13 tetap saja ngelek tolong di perbaiki papi monton🙏🙏,3
apk rusak seruan season kemarin wleeeekkk🤮🤮🤢,1
ga ml ga ini masalah utamanya ya dijaringan ajg bangt dari awal Ampe late game merah trus ping nya giliran darah udah tinggal 19 udah mau kalah lancar jaya kaga ngeleg samsek ping nya hebaaaatttt banget😂,1
dari awal loading screen tiba tiba menghubungkan kan ulang trus sampe ke akhir sampe relog 5 kali ga jelas padahal sinyal bagus,1
sangat puass,5
