content,score
Game nya kurang seru aku main kalau ganti blessing gak sesuai harapan terus memang aneh,1
yeyyyy,5
"aku udah mainin magic chess dari bertahun tahun yg lalu, seru bgtt",5
montoon kikir,1
update lagi dong yg lebih bagus tampilannya sama banyakin bonus bonus dan diskon untuk beli chess board nya,2
"enak main nya, santai dan gk bikin emosi",5
"fatebox gajelas,musuh bisa dapat hero bintang 3 seharga 5 gold di level 9.sedangkan gw cari hero 5 gold yang di inginkan aja susah di level 9. susah banget dapat hero untuk sinergi yang lagi dibuat sementara musuh gampang dapetin hero dengan sinergi yang dibuat. makin kemari makin busuk,belum lagi sistem dibenahin udah muncul commander baru yang makin gak masuk akal skill nya. keliatan game ini hanya mikirkan player untuk membeli commander dengan diamond tanpa memikirkan untuk perbaiki sistem.",1
👌👍👍,5
ok sip,5
moonton ⭐,1
scam,1
"sistem down sendiri padahal sudah masuk game, masuk lagi down lagi sangat merugikan player padahal sudah naik bintang alhasil turun lagi.. tolong perbaiki demi kelancaran, gausah banyak even ga jelas memperberat game",1
ngak bisa di gunakan baru aja maen ajing emang,1
suka karna gw gajorrrr😀,5
game nya bagussss kaya agussssss,5
"game nya sangat bagus bahkan bisa bermain bersama teman"" jadi semakin seru",5
its a good game foreveaaaah,5
jangan download game ini. grafiknya buusuk! cuma buang buang kuota data saja,1
game nya udah udah lumayan jago hero tapi malah ulang dari awal,4
"skin Transformers Jonson nya kok ga masuk di mcgg ,padahal dah habis banyak diamond waktu draw di magic chase",1
Hadduuhhh,2
"game rusak... player lain gampang banget bikin hero gold 4/5 b3 d level 9 sedangkan saya level maks masih kesusahan bikin hero gold 4/5 b3... buat orang"" yg mau instal ini game pikir"" lagi.. sistem mcgg sama kayak mlbb.. d mana sistem nya membuat player lain hoki sedangkan kita sial terus",1
"permainan terbaik,best games ever",5
"gajelas, Hero kuat cuma kalo dipake musuh. Moskov B3 kalah Ama Ling B3, Tolak ukur Powernya Rusak. Mending Sistem dulu, Sekarang Pencipta sistemnya ga ngerti game ini. bodoh",1
tidak se enak mc di sebelumnya yang masih nyatu KEMBALIKAN MC SEPERTI KEMARIN GARA2 MC SEKARANG HAMPIR SEMUA TEMEN SAYA UDAH GA PADA MAIN LAGI,2
sangat menyenangkan dan asikk,5
scrol Hero nya TDK memuaskan,1
tolong nerf Commander karina op banget tolong banget balikin jadi 15% sampai 25 % HP saja,1
Mantap.,5
bintang 4 aja KLO apl bisa menghasilkan uang baru bintang5,4
"Bagus bangett, gamenya asik dan gak bikin bosen!. Ini game strategi yang mengharuskan kita untuk lebih fleksibel dalam memilih. Menurutku, Keberuntungan itu datang ke orang yang dapat memanfaatkan kesempatan dalam sistem, bukan yang hanya bergantung pada suatu sistem.",5
game idiot,1
dulu pernah main seru apalagi ini,5
katanya main nih game jadi santai malah emosian game ga jelas mending ff,1
ok bagus,5
untuk segi gameplay gamenya sangat bagus dan seru jadi kasih bintang lima aja🥰,5
asik banget,5
So far so good,5
"menurut saya ini bukan game satategi tapi game ngandelin lucky banget , tergantung masalh hoki juga",1
disconnect teruss game tolol,1
"Tiba tiba menghubungkan ulang, padahal sinyal bagus!",1
kumooohooonnn admin atassii segera masa aku login selalu kesalahan jaringan harap coba lagi padahal sinyal mencapai 2mb tetep ae r isooooooo kepengin main lgi ni,1
"Game nya sangan seru dan heboh banget, sama aja kayak game honor of kinzs.",5
masa ga bisa masuk stak di loading terus game gajelas,1
"gajelas, slot 5 yang harusnya 40% buat harga 2 gold yang keluar malah harga 3 gold terus",1
makin kesini makin anzing gamenya.synergy gak pernah dapat.40 kali refresh gak dapat hero yg sesuai.giliran dah cantik susunannya ehhh satu hero franco gak dapat.game lebih totong dari totong,1
❤️❤️❤️,5
"MIN TOLONG KEMBALIKAN MAGIC CHESS YANG DULU, KALO GA DUA DEH SAMA INI YANG DULU DI ADAIN LAGI",3
game cupu kalo eru 99 langsung Hero aja jangan miror,1
bagus tapi update kelamaan mungkin update di server global mungkin biasa di percepat ya,4
game yang sangat bagus tapi ada comander yang sangat ngeselin yaitu wanwan,5
"setelah dipisah dari ML dan jadi apk sendiri, sangat buruk. hubungkan ke akun lama malah tetap jadi akun baru. maka solusinya langsung un-install dan nggak akan main apk ini lagi",1
"saya kecewa ketika pada saat saya menggunakan skil vale trus mengunci shop, selesai babak pertandingan selesai, hiro yang saya kunci di babak sebelumnya itu udah hilang, dan kunci hiro masi tetap terkunci",2
moonton mungkin update berikutnya bisa ditambahin waktu teamfight jdi 1 menit 30 detik pdhl bisa comeback malah kalah karena waktu abis,4
"shop sudah di lock eh malah di refresh di babak selanjutnya, dasar dark system😂",1
🗣️🔥💯,5
"jangan hanya dikasih mode practice nya ke konten kreator juga, semua player ingin merasakan mode practice, Hero semua gold, commandernya, lineup yg bagus, dan sinergi yang mau dipake juga. jadi tolong update game ini supaya semua player senang yg main dan have fun. terimakasih.",1
udah beberapa minggu ini mobile legend dan magic chess agak nge lag padahal untuk yang lain jaringan aman lancar .. hape 7 juta ke atas harganya juga,5
"dah tau gua hp nya burik dipindahin jadi black screen,balik in ke moonton yang dulu",2
"Kalah menang itu biasa,yang penting bikin happy aja karena cuma game..",5
jossss,5
mantaaaaaap,5
"Gamenya sudah gak asyik, UNINSTAL saja.",1
ngeleg nya parah banget jadi tolong diperbaiki lagi,5
game nya enak tapi Hero yang didapatkan saya tidak sesuai lineup,5
santai min😇😇,5
seru bagus banget,5
apa laa ini permainan burik,2
ada bug hero tiba tiba hilang di chessboard,1
suka rilok sendiri tolong game perbagus,2
"overall bagus cuma ada hal yg sangat"" disayangkan, yaitu optimalisasi game ini masih terbilang kurang baik, saat saya bermain game ini banyak sekali frame drop parah yg tadinya 30-35 bisa menjadi 5-10 fps saja pada akhir"" ronde yg dimana ini sangat mengganggu sekali padahal saat saya bermain mlbb yg ukurannya lebih besar lancar lancar saja,, itu saja pesan saya untuk developer tercinta semoga optimalisasi game ini terus ditingkatkan.",4
"sangat sulit untuk mencari hero di tier mytic honor, membuat saya stress dan ingin melempar phone saya",1
makin gak jelas masih mending yang sebelum di update,3
"Makin kacau sistemnya sekarang , Hero yang 1 sinergi atau mau naik bintang susah keluar , Giliran hero lain yang beda sinergi muncul terus , Giliran nge roll malah susah lagi heronya",1
game nya bagus gampang dan kalau mau naik bintang Susah banget cari heronya monton kalo gak dibaca pesan gua gua kasi bintang satu,1
"Hero Minotaur terlalu overpower, tolong adakan nerf untuknya",4
game kikir developer kikir jangan main,1
"kecewa dengan update an sekarang, efek blesing harus di hilangkan, sangat tidak seru dimana 6 player bisa menggunakan 2 sinergi yang sama dengan full 6 hero, ujung ny bukan adu skill malah adu keberuntungan, yang dapat hero duluan yang menang.",2
untuk kombo domstrom memunculkan hanabi B3 jangan terlalu sakit repott yang roll bawah min,5
"gamenya bikin kecewa , ga sesuai ekspetasi , monton tolong di kondisikan, kasih yang enak enak gitu kek heronya jangan mau main sinergi ini , malah munculnya itu, kecewa berat , sangat kurang rekomen",1
"game scam, update trus bug GK di urus",1
"game nya seru, cuma developer tolong dong download data dalaman nya bisa di pause🙏,. Si Kaja Dateng kemari, segitu aja terimakasih",4
"matching nya tolong lah benerin guoblok, masa iya honor 100 ketemu global 3 tolol banget matchingnya padahal solo",1
pertahankan,1
mntp pokok nya,5
kecewa banget dari legend 2 turun ke legend 6 di season 2 ini padahal s1 seru banget main sampe mitik 32 gw terpaksa uninstall ini aplikasi bukan ngilangin stres malah tambah stres,1
"bagus , tapi montonya kaya aga ngelunjak kalo dapet sinerginya 1 lagih",5
"Sering banget dikasih roll rollan utk saling nabrak dgn player2 lain padahal sengaja ngalah main combo lain tp rollan tetep aja dikasih untuk nabrak, game ini bener2 ga sehat. 1. system yg sengaja buat player kesusahan bentuk combo, jadiin hero, dapet item apa dikasih rollan nya apa, ambil itelm magic dikasih rollan hero fisik, ambil item fisik aspd dikasih rollan hero magic. 2. system matching jika solo harusnya sesuai rank, tapi faktanya romawi pun bisa ketemu glory. 3. dll masih banyak.",1
"tolong lh kalau pakai sinergi yang dipilih banyakin hero yang ada di sinergi, ini malah dimunculin hero hero yg nggak jelas bikin koin abis aja , malah dapat nya hero yg lain yg nggk di pakai bikin malas main aja",1
gamenyg cukup seru...,4
"""Game ini menawarkan pengalaman yang luar biasa dengan gameplay yang seru dan menarik, memadukan elemen kompetisi yang membuat setiap pertandingan menjadi menegangkan. Desain grafis yang memukau dan mekanika permainan yang halus menjadikannya pilihan sempurna bagi para penggemar game yang mencari tantangan dan kesenangan.""",5
bikin enjoy game nya,4
game di kasih kartu Hero harus nurutin kemauan server dan kalo apa yang kita mau ga keluar ga bakal di kasih kasih game apaan makin kecewa mobile legend kalau udah punya nama jadi ngatur segalanya 😂,1
seru di mainkan,5
karena moonton,1
good👍,5
"Yo matur nuwun Yo moonton,akun ku di gawe kalah wae pas main ga Popo,gawenen kalah terus,ga popo.ngalahke akun ku thok wae ora rugi koe..push rank /magic rune Podo ae malah mudun peringkat e.Iki menawa enek bintang 1000 mesti tak kek i.trus 3 akun ku ilang padahal pas gabung mlbb sering tak mainke,kari 1 Iki malah lose streak AE..",5
game seru dan menantang it is amazing,5
game burik gak mutu grafik cacat kek main catur,1
"-1 jadi bintang 3 , selalu dipersulit, padahal udah late game",1
monton scam bngst,1
kenapa sekarang jadi patah patah kalo lagi war,3
godd,5
game nya sangat seru dan tidak membosankan,5
sangat seru buat waktu luang,5
game nya banyak cheat,1
"Game nya seru, Hard Thinking Dan Juga Tidak Bikin Bosan",5
game bagus dan memancing emosi,5
tolong jgn terlalu besar datanya biar hp ram 2 bisa maen juga,5
"sebenernya udah cukup baik tapi sekarang bayak mode mana lagi beda mode beda synergi, yang bikin susah itu kalo kita buat synergi contoh wm terus di slot ngasal semua, jadi kaya kalo menang itu dipaksa menang kalo kalah ya dipaksa kalah.",4
makin gk jelas 8 orang masa 3x ketemu orang yg sama di tambah rolannya pun gk jelas,2
makasih ya moga lancar.,5
GM nya bagus,5
"saya suka dengan ada nya terpisah menjadi 2 aplikasi ini, Saya juga tetap aktif bermain MLBB dan MCGG. KLAU SAYA BOLEH SARAN, BISA TIDAK KETIKA BERMAIN MC GOGO TETAPI MISI PERMAINAN DI MLBB TETEP JALAN JUGA. KARENA SUSAH KETIKA ADA MISI BERMAIN BERKALI-KALI DI MLBB KAMI YG AKTIF MC GOGO HARUS GONTA-GANTI LOGIN APLIKASINYA. KARENA SEKARANG LEBIH BANYAK AKTIF DI MC GOGO, SEHINGA MISI DI MLBB TERTINGGAL JADI NYA. Terima kasih semoga ada perubahan nya.",5
keren asik pantas tik,5
game apaa ini jir,1
gak kayak dulu apk nya di pisah,5
sering lag tiba tiba padahal sinyal penuh pake wifi juga sama aja,3
magic cas gogo bagus 👍,4
"tidak rekomended untuk dimainkan, kemenangan tergantung nasib dan sistem, dikomplen lewat Customer Service jarang direspon, kalaupun ada respon kata-kata template, dan tidak ada perubahan, bagus untuk diuninstall",1
bagus banget coyy cobain deh,5
"Game hama. banyak Commander bisa ikut nyerang, game ngandalin hoki",1
"woi, commander kayak Miya, wanwan, sama karina dihapus lah, orang lagi posisi menang tiba tiba kalah diserang commander kayak gitu, game yang awalnya asik tiba tiba jadi ga asik selama ada commander yang bisa nyerang dari luar",1
seru bngt dan ini aku dawunlod karena di ajarin kakak ku😊,5
game nya seru tapi kalo bisa sinergi nya di tambah,5
mantap 👏,5
yes good,5
game yang gak pernah bikin bosan,5
lumayan seru tapi juga bikin stress😖😭,4
Bener Game anjg gameplay gak seimbang,1
ini game sangat bagussss,5
"gaje kalo mau menang harus hoki, terlalu mengandalkan keberuntungan kalo ga beruntung ya nyungsep, rate menemukan hero yang sama dengan sinergi sangat kecil fase LV 8,9,10 terlalu sering muncul Hero harga 3 gold padahal rate untuk gold 4 harusnya lebih tinggi dan terlalu susah untuk mendapatkan clone Hero dan biji sinergi. item damage tidak berasa kalo ga pake Gogo card game ini bukan strategi tapi lebih ke game gacha Hero lu lebih bagus lebih beruntung lu win.",1
Tolong Tambahkan Fitur Booking Gogopas Agar Player yg Blum Mempunyai Uang Bulan Ini Bisa Membelinya Di Bulan Depan Agar Bisa Terbeli Skin Yang Ingin. Dimilikinya Sekian 🙏🗿🗿,5
good 🤩,5
seru banget game nya,5
"dasar Fatebook sampah, gak pernah dapat item yg gua mau,mau ngambil sinergy gua mau gak pernah dapet, ditambah lagi setiap sinergy gua mau jadi ada aja yg nabrak, intinya ini game tersampah menurut gua",1
game seru banget,5
game keren pastinya..,5
game scam anj ga mole ga mcgg game scam semua,5
mantab walau kalah mulu,5
lol gua main ml lawan mantan imo,1
"jelek, kalo lagi nyari sinergi yg di pengen ga muncul,udah slot 8 Hero 4 ga dikasih sama sinerginya, masak slot 8 9 Hero harga 4 ga di kasih,",1
"Memang ini game sudah mengurangi unsur P2W, tapi terkadangan stock Hero yang ingin dijadikan hyper carry padahal stock nya masih full sering banget susah dapetnya kayak ""berasa pajangan"" & juga kadang musuhnya gampang banget dapet Hero legend padahal saya lvl 10 & dia level 9 saya kan ambil Hero yang dia mau buat B3 gw ambil 2 heronya dia cuma punya 1 clone entah bagaimana bisa dia bisa B3 in karena waktu stocknya sisa 1 yang keluar itu 2 Hero langsung. tapi tetap menyenangkan walaupun simpel.",5
sy suka game ini,5
gamenya seru cuman tolong d permudahkan lagi untuk mencari sinergi nya masih cukup sulit drak sistem nya,5
Dark Sistem Yang main gratisan jangan coba-coba dah.. bakal susah dapat Hero nya.. hoki nya jarang jarang.. mending uninstall aja lah,1
keren banget sampe aku main udah lama ada semua hero mlbb ini game faforit aku sama mlbb,5
"game apa ini masa gua mainn naik turun bintang nya setak di lagend 3 terus dari dulu main kalah menang kalah menang tidak naik"" bintang nya",1
mantap gan,5
kadang suka ngefrez kalo udh selesai permainan tolong di perbaiki secepatnya,4
"hapus aja sekalian persentase kemunculan hero nya, ga guna, roll di persentase paling tinggi kemunculan hero, ga muncul2, sisa hero masih banyak, sinergi ga nabrak, dark system nya parah bet, bukan cuma sekali dua kali, bikin malas main jd nya, ngotak dikit lah",1
MC go go tidak sebagus waktu masih gabung MLBB jadi aneh 😭,1
"kecewa, sudah punya akun di MLBB dan masuk ke mode mcgg, kenapa tidak otomatis masuk, harus masukin manual isi email pasword MLBB, karena saya tidak ingat sandi akun MLBB",1
oke magic chess udah oke banget dah,5
game nya seruuuuuuu bet dah,5
lama lama bikin stress ni game kalah mulu,1
gg kalau buat game,5
Asikk,5
permainan sangat bagus dan baik untuk mengasah kemampuan anak dalam strategi dan taktik yang mau di mainkan dengan siapa harus siap.,5
permainan sangat baik,4
permainanya seru dan asik😄,5
moonton HAMA,1
"untuk gameplay sih sdh bagus, tapi knp setiap match baru di mulai tiba tiba re login lagi dari awal? plisss tlng di benerin bug nya kerana sangat mengganggu segi kenyamanan🙏🏻 udah itu aja moga aja fi denger developer ny🙏🏻🙏🏻",3
game yang menarik,5
bagus sangat menghibur sama buat uji mental kalau lg bau,5
sinyal dan sinyall bermasalah,2
"ngotak lah klo kasih blessing, udh d reset seribu kali masih tetap sama, kocak..!!!",1
"game bikin setres, darah gua udah sekarat malah di hadapin sama musuh yang paling kuat, ta!",1
"tidak bisa berkata"" LG, biar bintang yg berbicara",1
a lama bet download data pulang nge bug,3
bagusss banget,5
balikin kaya dulu lagi MC GG nya,1
sampah bgt game ini sekarang. the real game hokki skill ngga di berpengaruh di sini. mau level 10 duluan vs level 8 kalo hero ngga keluar ya ngga akan muncul di shop. bakalan tetap aja kalah. sampah 🚮,1
"Game Gacha, Lucu bgt udh mau fase 3 hero yg gua pake ga muncul2, sementara hero musuh udh bintang 2/3. Bukan cuma sekali, tapi udh berkali2. Hero2 yg mau dipake ga muncul di shop, card blm tentu cocok sama combo yg dipake, item muncul juga blm tentu cocok sama hero yang dipake, dan hal lain yg terlalu gacha. Saya kira bakal lebih baik dari Magic Chess ML, ternyata lebih buruk+ampas, jadi saya hapus aja.",1
padahal musuh masih 7 tpi bisa 3x loh ketemu musuh yg sama dalam 5 round ( 4 round player + 1 round creep) emg sengaja mau di bikin tooson moontod.,1
Keren abiz,5
manarik...😁,5
GAME RUSAK!!!!,1
"game bagus poll,tapi menurut saya kurang dengan ketiadaan leaderboard",5
eruditio tolong di nerf,5
"game kn""tl gk jelas , combo gk jelas, ppk lah",1
seruuuu game nya,5
Seru aja,5
mantap lah,5
"game rusak, susah bet dapet hero bintang 3 , sinergi yang menang itu2 aja, di buat seimbang dong semua sinergi nya",1
"semakin kesini semakin susah untuk jadi 10 faction, tuk dapetin 2 magic crystal yg sama juga sulit, tolong perbaiki",5
"apalah ini gamenya kurang seru karna susah ketemu Hero yang di butuhkan, Ada juga Hero yang muncul gratis gitu agar makin kuat deh. tapi malah bikin kalah kayak apalah malah mati karna menambah Hero acak kayak Popol dan kupa deh aneh banget",1
Good job slam dri Sena007,5
game kocak tinggal 1 lagi b3 tapi malah ga di kasih udah di kecilin semua hero tapi ga dapet sama sekali kocak banget emang,1
permainan ini sangat bagus saya suka,5
ok lah klo buat hiburan seru gamenya gak bikin bosen,5
sangat menyenangkan sekali.....,5
"WOI MOONTON LEBIH ADIL DONG, TOLONG LAH NERF ROLL BAWAH. MASA IYA EARLY-MID GAME KENA 20 DAMAGE. KITA YANG ROLL ATAS GIMANA CARA BERTAHAN HIDUPNYA,PAOK PAOK ANAK EMASIN AJA TU ROLL BAWAH",1
"game scam, php",1
Aplikasinya bagus tapi ada yang kurang mohon sedikit perbaiki,4
makin ksini makin lumayan,5
"game paling tidak masuk di akal.full sinergi aktif,hero 5 gold bintang 3 kalah dengan hero 4 gold bintang 3!",1
sinyal tiba - tiba hilang,1
"gw suka sama game nya tapi gw ga suka sama orang yg buatnya gitu ajah sih, sakit yg buat",5
rame bagus dan menarik,5
gema nya burik masa sinyal normal tiba-tiba ngeleg,1
game yg sangat bagus untuk waktu luang,5
sangat bagus gamenya,5
puas bgt😁😁👍👍,5
"bagus sih...cma semenjak mc dipisahkan dg mole banyak sekali perubahan. mulai dari rank, comender, skil comendernya gk kayak yg dulu ada tiga skil, bahkan di revamp terlalu banyak...saran saya agar nyaman dan tidak bosan ganti sinergy barulah disetiap satu season atau dua seasonlah supaya penuh tantangan untuk player mc...sekian terimakasih 🙏🙏",5
buruk gak pernah di kasih kartu yang bagus.. lol,1
"jangan sinergi mulu yang dipikirin pas update, tapi perbaiki fitur lain yang masih banyak kurangnya. misal: sesudah selesai match (tidak) bisa liat profil lawan, ban commander harus yang paling banyak di vote, fitur-fitur di profil (seperti: foto/album, hadiah, dll).",1
gw kasih bintang 5 karna Aurora chibi hot bgt gilakk🤤🤤,5
",👍👍",5
game ampas mati ae anj,1
sangat menarik dan asik,5
game asu,1
"game buruk, mengandalkan keberuntungan dasar game buruk, saya kasih bintang 1 karena kamu tidak memberi saya cyclops bintang 1",1
bagus banget commander nya yg imut dan grafik yg perfect 👌🏼🤭😁 💪🏼😗,5
kasih waktu jgn 30 dtik lah,1
GAME AMPASSSSSSSSS..... AMMPASSSSSSSSSSSS AMPASSSSSSSSSSS SAMPAHHHHH,1
mboh gak roh apik opo ora,5
"tolong lah moonton saat di late game tambahin waktu nya jadi 1 menit kurang lebih soalnya di late game pemain pasti AL-in untuk Hero utama nya,nah saya kejadian Hero Natan saya sudah bintang 3 tapi sudah keburu mulai Al hasil ga sempat dan saya kalah",3
"game gacha ga jelas, gw nyari Lunox di level 8 ga dapet-dapet padahal masih utuh di shop, semoga MCGG cepet tutup dan tidak ada yang top up",1
game suantai,5
game membuat Kita untuk mengambil resiko sebesar apapun,5
Game lawak Dark system gak berhenti2. skill overpower gak di nerf. unistall aja lah bosenin,1
aplikasi game ini sangat bagus,5
game taeeeeee,1
game ampas up mahal heronya busuk,1
kalo buat event di tiktok jangan di tarik lagi lah uangnya baby,1
epic susah banget ketemu hero,3
sistem gacha hero yg bener lah kasih hero yg di butuhin,1
"game rusak, kalah menang diatur developer",1
bagus game bnyak yg main kendala cuma di jaringan lemah suka menghubungkan saat main.,3
"sistem manipulatif, sistem pemilihan Hero yang bodoh",1
huh,5
"mengecewakan udah up ke level 8 ngincer Hero yang di cari cari susah,udah bosen gitu gitu aja sampe lose trek 12 kali emang dasar",2
"sering lag, ping selalu tinggi. 1x kemenangan 6x kekalahan. sistemnya seperti slot. di awal dikasih kemenangan setelah itu kalah.",1
bgs bgt JD peng main lgi,5
game seru saya jadi kecanduan dan tidak kerja,5
joss penak yakin,5
"game ampas ,sinyal bagus di bikin ngelag mulu",1
game makin keren,5
game oke cuma pas mau ke in game malah relog tolong dibetulkan tindakan ini sangat membuat kesal,2
bagus-2025,5
kurangin damege Hero 1 gold bintang3 lahhh,1
"matchmaaking udah dicancel, tapi masih lanjut. makin ga jelas scroll heronya. fase ban tidak relate dengan voting. makin ke sini makin nyebelin main mcgg.",1
makin ke sini makin engga jelas . sulit di mengerti update yang sekarang,1
sangat rekomendasi untuk bintang 1,1
gamenya bagus tapi kadang nyari Hero yang di butuhkan susah kena dark sistem,5
enak buat nemenin waktu senggang,5
💪,5
"game banyakan Dark System,,, taiiilah",1
seru adrenalin saat transisi,5
game nya bagus banget dan juga seruuuuu,5
game panteq . selalu garpu 3 bijik,1
terlalu mudah skrng match ny haha🤣🤣,5
banyak bug nya dan tidak jarang tidak bisa di tekan,1
"game makin kesini makin tidak jelas, kadang Hero yang dipakai susah sekali keluarnya setelah di fresh, seperti tidak adil dalam permainan, makin terlihat ini game hoky""an, mau sebaik apapun strategi nya kalau moonton pelit gak akan menang",1
Parah kali kau moonton ngasih Hero tak pernah bagus apalagi di mode gold rush,1
rolling gak jelas kurang 1 Hero lagi biar B3 Tah di Tarok kemana padahal di shop masih sisa 1,1
cobain magic cas Gogo di jamin ketagihan saking serunya,5
punya gw mcgg nya gampang mental monton,4
gak bisa berkata kata ini game enak banget,5
kerennnnn,5
game mantep,5
Karena Bisa ngalahin pak salim,5
gem ya bagus banget,5
"game ringan sih katanya tapi kok pas main lag, patah patah Mulu ya trs kadang suka berhenti sendiri gamenya tolong di perbaiki dong biar gak berhenti sendiri",1
"klihatan bngt, susah mencari hero biar jd bintang 2 at 3, trkadang yg semngat main malah di susahkn mencari hero yg sama, pemain yg jarang main malah d manjakan dg gampang mencari hero yg sama.. harus ny seimbang dong, masa iya sudah lvl 9 at 10 mencari hero yg sama sampai koin habis bnyak kadang dapat lebih bnyak tidak",2
"average is good but my suggestion, add chess TD, please we chess TD fans really miss that feature",5
ok banget,5
enak aja santai,5
"sangat meresahkan, setiap saya sudah mendapatkan sinergi yang dibutuhkan, saya jarang mendapatkan salinan hero untuk menaikkan bintangnya, sedangkan musuh saya sudah banyak yang dapat bintang 2 bahkan bintang 3,walaupun saya sudah merefres shop berkali-kali masih tidak mendapatkannya, mohon perhatian pihak developer, karena yang seperti ini sangat mengganggu keseimbangan pemain-pemain lainnya, terimakasih",1
"GAME NYA MAKIN LAMA MAKIN NGEBOSENIN!! SINERGINYA ADA YANG JELEK BANGET ADA YANG BAGUS BANGET UDAH BISA DI TEBAK!! KOMENDER ADA YANG GAK ADA BERFUNGSI UNTUK MAIN DI INGAME MENDING HAPUS ATAU DI UBAH SKILLNYA, SAMA SARAN SEDIKIT BUATKAN MODE YANG BISA MAIN TAG TAEM BIAR BISA DI INGAME ADA 2 SKILL KOMENDER YANG DI PAKAI SAMA TEMAN CONTOH A PAKAI POPOL SI B PAKAI KAGURA DALAM SATU IN GAME BIAR SERU.. MOHON DI DENGAR MOONTON",3
"ngapa layla di nerf baru aj dapet skin aspirant, dahal gk op op banget ngapa layla di nerf dahal baru dapet skin aspirant, gk OP dia",4
Anjying,1
hero buff nerf mulu cape aku ngikuti trs hero yang awal balance malah di buff kan kocak sebelum nya wanwan sekarang mia mau mu apa si njirr cape gw,4
mantabb pisan min👍🏻👍🏻😎💪🏻,5
GK bosenin game bagus ..,5
bagus juga tapi musuh ya harus seimbang lah Monton,5
mantppp,5
game plagiat tidak bagus dan tidak kreatif bintang 1 masih kebanyakan buat nilai nya,1
GAME BROKEN...,1
bagus asyik dan santai,5
LUCU GK JELAS PILIH KASIH,1
gak kaya dulu dulu kaya gak @mldulu,1
"game rusak, game cacat, player yg sdh juara 1..., 99% di game slnjutnya bklan d buat kalah oleh sistem dan tdk mndptkan point, mulai susah mendapatkan hero yg d butuhkan, player lain d buat gampang membentuk sinergi dan heronya di buat cpt naik bintang, sdngkan kita bkln d siksa dgn sulit membentuk sinergi...",1
game tidak adil,1
"game yang bagus, dan mengasah otak",5
"apa gak bisa dark system dihilangkan, aku dari mityc 45 kalian buat sampai mityc 20.",1
"game burik ...tengah malem gua download lagi setelah vakum ,ingin main MC ternyata sudah terpisah ,mau login akun MC yang terhubung ke MLBB hilang ...akun MC tidak bisa login ke akun yang dulu ...woy balikin akun gua yang dlu bangve",1
kecilkan ukurannya kalo perlu buat versi lite ini sering lah dan patah-patah setiap main karena kalo gak jaringan yg stabil ya kemungkinan besar di gamenya ini karena sering banget tiba-tiba nglag lalu free GK jls pdhl jaringan aman WiFi data penyimpanan jg masih sisa,1
saya suka banget,5
"parah banget, nyari Hero gold 3 di lvl 7 keatas gak dapet dapet sampai kalahnya. bener bener rate-nya kacau",1
game untuk santai,5
bagus grafik nya juga keren,5
seru buat skrang,5
burik sistem nya jelek,1
aku terhibur,5
aku sangat senang,5
game tertolol dan buruk!!!!,1
perbaiki lebih keren lagi main👏,5
mantab ini,5
good games,5
muntun tempek,1
kenapa error,1
"disaat relog dalam permainan, terdapat bug atau error disaat mendapatkan item malah tidak muncul atau menerima item, ITU SANGAT MENGGANGGU!!",2
"Tutorial tidak bisa di skip, untuk pertama kali install, mana lama lgi",1
"tutorial tidak bisa di skip, mana lama lagi",1
#1 bre,5
