Ulasan,Rating,Aspek,Sentimen
najis game dark sistem kalau bakal di kasih kalah kelihatan sekali giliran menang dikasih lawan seperti bot tidak seru tidak ada tantangan,1,satisfaction,negative
game tolol fungsi tombak ziling yang nyebab ini freze buang saja hero musuh benar kena freze tapi kagak bisa di hit tolol,1,satisfaction,negative
sekarang malah sinergi tidak pernah jadi terus herony,1,unknown,negative
permainan hanya pakai atau beli diamond baru bisa menang game laknat,1,satisfaction,negative
makin kesini bukan makin seru malah benar benar seperti judi uji keberuntungan doang enggak ada asah otak have fun buat exsperimen makin sulit ya itu karena ngandelin keberuntungan doang,1,satisfaction,negative
tolong lah kalau bisa commander wanwan dihapus saja hama sekali ikut campur hero di line up saya rating dulu kalau sudah dihapus itu commander baru saya rating hapus commander hama miya wanwan tolong,1,satisfaction,negative
mohon buatkan mode practice overall semuanya sudah bagus,5,satisfaction,positive
developer tolol soal sistem matching sistemnya seperti babi dari segi sinergi hero sampai health point saja saya paling bawah malah dilawanin sama yang health pointnya masih sinergi sudah bajingan tolong rombak lah sistem bagian ini jangan dibikin acak atau sesuai urutan terus bagian item magic crystal sama blessing dropdapetnya jangan random juga lah tidak adil sekali sama lawan yang dapetnya selalu saat sudah mah saat di fate box dapetnya sisaan di babak creep juga dapetnya item ampas,1,satisfaction,negative
sudah cukup bagus tapi mohon perbaiki bug apabila menyimpan replay gameplay sendiri malah hilang sendiriterkadang ngefresh tokony hoki² an saja padahal persenan keluar gold bintang herony tersebut sudah paling besar tapi tetap saja ngefresh kali tetap gadapat² padahal stock herony masih ada ini kejadiannya sudah berulang ulang saya dapati,2,satisfaction,negative
saya belum download data gamenya saja sudah lag parah woi sampai black screen beberapa menit,1,effectiveness,negative
game ini sangat cocok untuk sambil makan dan sambil menonton tv,5,satisfaction,positive
saya sekarang sudah merasa lebih old karena saya main dari sih,5,unknown,positive
game enggak jelas drop rate hero di shop gajelasss,1,satisfaction,negative
sama seperti saudaranya kemenangan dan rank tinggi bukan dari skill melainkan dari keberuntungan dan juga keberpihakan semoga kedepannya semakin sepi peminat,1,satisfaction,negative
kok jadi di pisah jelek ah,1,satisfaction,negative
penyakit mc gogo gila,5,effectiveness,negative
kumooohooonnn admin atassii segera masa saya login selalu kesalahan koneksi harap coba lagi padahal sinyal mencapai mbak tetap saja r isooooooo kepengin main lagi nih,1,effectiveness,negative
kasih pemahaman lebih tentang combo,5,unknown,positive
kocak amat ini game bisa memakai cit bjir aowkwkwkwk,1,satisfaction,negative
suka rilok sendiri tolong game perbagus,2,satisfaction,negative
serius game membuat nagih penasaran seperti catur menguras otak mantap yang membuat ini game yang kasih rating jelek pasti kurang dalam berpikir dalam tindakan ibarat main catur moderen kalau kalah masa merengek,5,satisfaction,negative
tolong lah itu ruby di mode magic rune nerf lah moonton apaan hero seperti begitu tidak bisa mati lifesteal nya tidak habis habis sekali muter langsung rata kalau seperti begitu mah sudah tahu siapa pemenangnya dari awal anjing,1,satisfaction,negative
tidak bisa fusuyon saat dibeli pemainya dipertandingan mulai,1,satisfaction,negative
mana vs nya mooontooooooonn,2,satisfaction,negative
tolong nerf gord permainan jadi tidak seimbang terlalu sakit masa satu hero bisa ngeratain hero jadi tidak imbang,5,effectiveness,negative
kerenapalagi mode rush royale,5,effectiveness,neutral
bagi saya ini game sampah buang waktu dan uang ingat nya ini bagi saya bukan anda mata rabun kurang tidur hilang ingatan ketika saat waktunya mendengarkan suara azan jadi lupa dan enggak kedengaran bjir gara game ini,1,satisfaction,negative
oy ton saya menggunakan comannder lunox itu berharap bleseing nya salah ini blesing saya lebih dari kali bahkan sampai nolan tetap ke eru semua kocak coba saja kalau saya menggunakan comannder lain pasti blesingnya samping terus wkwkwk kocak ton ton,1,satisfaction,negative
menang dan kalah terlalu di seting sama montoon bintang bintang memang masa hero masih ready banyak mau up bintang saja susah nya seperti n saja ng slot mencari kaja bintang saja sampai habis gold n saja n memang sih montoon,1,satisfaction,negative
game nya sudah bagus perfect tapi tolong kondisikan lah itu commander jhonson ya pasti auto win kalau lawannya itu,5,satisfaction,negative
game kintil sehabis nomor setelah itu selalu nomor lama lama makin tidak jelas cok,1,unknown,negative
sudah cukup bagus cuma updatenya doang yang keseringan dan masalah sinerginya jugagak masuk akalharusnya digampangin deh ada yang bisa tapi tidak pernah kena cuma doang,5,satisfaction,positive
seru tapi kok legend nya sampai tidak seperti biyasanya cuma sampai,5,satisfaction,negative
perfect sih asik asik saja banyak player yang kangen mode nostalgia sekarang sudah di rilis kalau player ngeyel kangen kangen mulu biarin deh di semua game pasti selalu kangen moment nostalgia jaman old apapun itu game nya mcgg juga kayaknya masih belum jelas ini moonton mau gimanain yang penting asik deh yang kurang itu fitur skill comander nya tuh doang jir terus mengadakan seperti clansquad begitu lebih bagus membuat menggunakan magic coin saja biar enggak usah topup cuma buat membuat squad,5,satisfaction,positive
game ya seru banyak ifen yang menarik walou tidak dapat skin,5,satisfaction,positive
ok bisa buat ngilangin bt,5,satisfaction,negative
perpanjang durasi sebelum war pak,3,effectiveness,neutral
ei montoon kenapa enggak ada benedetta di mcgg,5,satisfaction,neutral
akun magic chess yang dulu menghilang gr gr yang sekarang padahal dulu masih bagus akunnya bad game bintang,1,satisfaction,negative
lebih suka megic cheese yang dulu sehubungan dengan ml dari pada pisah jadi ngumpulin duit atau bpnya susah,1,satisfaction,positive
nerf eruditio pliss meresahkan terutama natan bintang saja tidak ngotak gold yang lain tidak ngelawan,1,satisfaction,negative
loding terus tidak bisa main,1,unknown,negative
tolong lebih di optimalkan lagi server nya beberapa kali main game nya nge lag dengan kondisi koneksi yang lancar dan harus di reload untuk bisa jalan lagi dalam game bisa berkali kali buat reload dari dulu server moonton tolong lah benerin,1,effectiveness,negative
sinyal gampang lag ini permainan beruntung sistem permainan kurang adil,1,satisfaction,negative
hiburan kalau bosan main rank,5,satisfaction,negative
saya suka mobile legend tapi lebih suka magic chess lucu saja enggak begitu memerlukan emosi jadi mengurangi dosa untuk tidak berkata kasar hahaha,5,satisfaction,positive
dear developer mcgg tolong untuk manajemen konten bagian download data bisa diatur tanpa download semua data di mcgg terima kasih,3,satisfaction,neutral
setelah update malah bug koneksi lagi main putus putus tidak jelas koneksi pakai starlink padahal,1,satisfaction,negative
menambah bapuk dengan sinergi yang tidak jelas enakan yang dulu,2,satisfaction,negative
bug jonny tidak mau nabrak,1,effectiveness,negative
aplikasi rusak sudah ngerol hero di persentase tertinggi hero nya tidak keluar padahal stok masih banyak bukan sekali dua kali sudah berkali kali seperti ini mending lu perbaiki itu deh kocak kocak,1,effectiveness,negative
terlalu banyak event tidak berguna harusnya pokus buat tingkatkan pengalaman bermain,1,satisfaction,negative
buat gameplay bagus asik juga tapi masalah nya pada waktu sebelum war nya sih agak kecepetan jadi agak sulit buat nentuin strategi ya saya juga mau bilang waktunya di tambahkan seperti di mlbb kan waktu nya agak lama tuh jadi di tambahkan saja seperti detik mungkin ya begitu saja maaf tidak jelas terima kasih buat game nya sekian adios,4,satisfaction,negative
tolol memang ini game memperbaiki lagi sistem nya masa paki hero harley dapat bukan sinrgi yang di mainin aneh di ubah apa saya ngstack di legendgara dapat hero sampah bukan nya dapat hero sinrgi yang sama malah dapat hero lain,1,satisfaction,negative
mcgg mengkonsumsi daya baterai lebih banyak daripada mlbb tolong perbaiki ini tidak efisien karena boros daya rank juga tidak seimbang angka romawinya tidak dicocokkan,4,effectiveness,negative
mending tidak usah update apa sinerginya baru op sekali rusak,1,effectiveness,negative
harga the observatorygacha skin legendcolectornya di naikin kali lipat tapi dapatnya di turunin jadi skin epic tidak ngotak memang sebelumnya game dapat skin herochessboard colector sekarang dptnya skin chessboard epic gwe auto pensi mending nunggu chess rush hok kalau begini,1,satisfaction,negative
sangat tidak cocok dimainkan masa cari hero yang dipengen susah sekali mana sudah habis banyak gold gadapetdapet naikin woi persentase hero harga nya,1,satisfaction,negative
server masih sering eror pelayanan customer servicenya jelek lambat saya beli diamond sudah seharian tidak masukmasuk tidak ada tanggapan dari customer service developer tolong diperbaiki ngerugiin orang seperti begini,1,satisfaction,negative
main nya mikir atur strategi meleng dikit ya kalah,5,effectiveness,negative
baguskapan turnamen season diadakan saya mau ikutsoalnya saya sudah mistik dan mau sekali,5,satisfaction,positive
game ok cuma saat mau ke ini game malah relog tolong dibetulkan tindakan ini sangat membuat kesal,2,effectiveness,negative
optimalisasi lagi dong gamenya monton nih game masih agak lag di ponsel saya heheh,5,satisfaction,negative
enakan yang dulu kocak,1,unknown,positive
game nya macet² tidak jelas kebanyakan event² tidak jelas,1,unknown,negative
game apa di atur beruntung,1,unknown,negative
aplikasi bego sementara main malah lag padahal ping bagus kocak,1,satisfaction,negative
gamenya seru grafik bagus tapi dalam hari terakhir terjadi error dan tidak bisa dilanjutkan matchnya sampai kehilangan bintang mohon respon nya agar kami dapat melanjutkan perjalanan season ini,5,satisfaction,negative
game tidak imbang rollingan kacau banyak nerf tidak guna roll atas dibatasi enggak bisa menjamin,1,satisfaction,negative
saya sudah uinstal donggngapain memiara game beginian tidak ada ssik asiknya,1,effectiveness,negative
tolong di sesuaikan lagi moonton dengan blessing harusnya,2,effectiveness,negative
game tolol skem burik lol minus iq,1,satisfaction,negative
masa saya epik dilawan sama lejen sama mitik tidak imbang sekali,1,satisfaction,negative
kenapa setiap lama tidak main data nya hilang sendiri dan harus download lagi tolong kenapa itu buang buang data saja,1,effectiveness,negative
game beruntung strategi probalitas roll hero kacau algoritma pun kacau,1,effectiveness,negative
sodara kembarnya moonton game tidak ada hiburannya,2,satisfaction,negative
bagus setuju juga kalau memang durasi setting lineup dilamain karena kerasa cuepet sekali gadikasi waktu mikir tapi yang saya permasalahin banyak seperti shadow touch nya begitu kadang kalau mau ngerefresh harus dipencet kali baru bisa dan kadang suka tbtb kepencet beli hero padahal ya tidak mencet terus kadang saat mau mindahin hero tbtb saat match kok malah keganti hero lain padahal posisinya lineup sudah penuh itu aneh sekali kan shop nya juga susah meminta ampun sih diatas lv dapat hero coin saja susah apalagi coin,2,effectiveness,negative
pola pikirnya dimana menang baris ke menambah bintang cuma kali kalah turun bintang kali,1,satisfaction,neutral
blessing fokus kan ke sinergi yang sudah adah tidak usah ngasal yang lainn,2,satisfaction,positive
tidaakk di ragukan lagi,5,satisfaction,positive
sangat seru dan bahagia,5,satisfaction,positive
sangat tidak adil sinergi sudah pun tetap kalah sama sinergi yang belum jadi sangat bedul sih,2,effectiveness,negative
game nya seru saya kasih bintang karena sering ada bug enggak jelas kadang terkeluarlah macetlah tolong di perbaiki lagi ya,3,satisfaction,negative
hero update dong jadi ada semua,5,effectiveness,neutral
kasih waktu yang lama lah cuma detik buat apa semenit lah minimal,3,satisfaction,negative
menurut ku game ini sudah bagus dan tidak ada bag nya tapi game ini tidak ramah ponsel rm dan game ini heronya termasuk sedikit kalau rekomendasiku game ini tidak perlu menambah kan grafiknya terimakasih,3,satisfaction,negative
game pay tapi win yang isinya dark sistem,1,satisfaction,neutral
saat memainkan sangat ez dan seru,5,satisfaction,positive
sangat bagus sekali game nya kak,5,satisfaction,positive
kenapa di rangked mitic tidak bisa band komander,2,effectiveness,neutral
apalah blessing nya tidak bisa di gunakan setelah update,3,satisfaction,negative
yang di tunggu² mode santai on,5,satisfaction,neutral
gila mennn ada sinergi lama terima kasih atmint,5,satisfaction,positive
semakin besar update aplikasi,5,unknown,neutral
sangat seru coba kalian mainin hhhhh,5,satisfaction,positive
kadang harum kadang busuk ngeroolnya,5,satisfaction,negative
kenapa stuck di loading screen ya,1,unknown,negative
karena saya suka main ini ketika di ml kalah yaudah oyo bang jefff bangkai,5,satisfaction,negative
game penipuan entar lu di kasih beruntung selanjutnya di kasih lose streak mulu maaf kayaknya bakal hapus,1,satisfaction,negative
magic chess gema tersusah yang saya main nin kenapa sih semuah hero tidak pernah dapat gema tolol,1,satisfaction,negative
tolong di adjust lagi gamenya adakan fitur lihat profil pemain lain yang belum berteman adakan fitur album seperti di mlbb kurangi event tidak guna yang dimana dikhususkan untuk orang kapitalis match making dan player yang sering berkata kasar ban tolong ban seperti di mlbb mute dalam pertandingan atau apalah item dari event kapitalis tolong hapus atau ganti dengan penukaran bp saja itu tidak guna sama sekali bagi kami player free tapi win sampah,1,satisfaction,negative
jangan pelit hero lah anjing,1,effectiveness,negative
scam tidak pernah dapat hero yang di pakai bintang sampai kalah game bodo,1,effectiveness,negative
game apaan ini orang orang selalu didapatnya hero yang dia inginkan giliran kita susah dapatinnya game apa ini tidak jelas susah dapat hero yang di inginkan tidak jelas sekali game ini,1,satisfaction,negative
tambah lama maintambah tidak seru,2,satisfaction,negative
game makin update makin enggak jelas tidak ada seru nya makin norak,1,satisfaction,negative
games yang menantang skill dan kemampuan berpikir,5,satisfaction,positive
sekarang magic chess susah dan sinergi nya banyak yang saya tidak pahami agar lebih baik menurut saya kembalikan magic chees di mode arcade atau ml agar tidak membosankan seperti mcgg,2,satisfaction,positive
tidak pernah hoky benar game gambling,2,unknown,negative
game tidak adil musuh sudah pada bintang saya masih bintang nya cuma aneh sekali tidak dapat sinergi yang pasudah begitu heronya acak lagi beda beda sinergianeh sekali bagaimana mau level up kalau begitu walaupun sudah ganti sinergi berkali kali tetap tidak ada yang saat soalnya setiap muncul tidak ada yang sama meskipun sudah ganti sinergi dan herotaik lah,1,satisfaction,negative
game broken parah broken sekali sih masa hero harga bintang harga bijipun kalah sama bintang doang tidak masuk akal,1,satisfaction,negative
tolong tambahkan events nya,5,effectiveness,neutral
ini maksudnya bagaimana yaclaim comd gratis sudah saya claim terus sekarang disuruh claim comd yang sama sudah di pencet pencet tapi tidak bisa lanjut kalau seperti begini bagaimana cara main nyaah tidak benar ini ini namanya sama saja nge bug tolong di perbaiki,2,satisfaction,negative
geam nya seru sekali dan ngehibur sekali dan juga mainin iq buat menang enggak ada event gratisan diamon wkwkk info diamon nyasar,5,satisfaction,positive
pertengahan pertandingan detik akhir pertandingan always lag ping berat apa²an mau up kesulitan karena semua tombol macet total mcgg payah kenapa hanphone spek ram internal gb dibikin down,2,satisfaction,negative
game mobile legends bang bang,5,satisfaction,neutral
selalu enggak di kasih hero yang di inginkan payah minton,3,effectiveness,negative
a lama sekali download data pulang nge bug,3,satisfaction,negative
game aneh tiba lag toll,5,effectiveness,negative
fokus saja di tindak kecurangan deh seperti nya,4,satisfaction,negative
sampah min gatcha nya tidak logis,1,satisfaction,negative
unfair battle if meet commander miya carina and wanwan too easy win maybe up the star until fix that,1,satisfaction,neutral
gamenya bagus dan seru bisa mengasah kemampuan analisa dan membuat strategi cuman game ini agak sulit untuk di pahami oleh pemula di karena kan mekanisme game yang sangat sulit di mengerti pada setiap permainan saran saya buat pemain perbanyak literasi dan cari referensi dari influencer jadi tidak hanya bertumpu pada sinergi hafalan saja,5,satisfaction,positive
lebih maju lagi mlbb,5,unknown,positive
masih enakan mc yang dulu semenjak upgrat syaa tidak pernah main mc bahkan saya uninstal ml dan mc tolong moonton kembalikan megic chess yang dulu karena lebih seru dan lebih menghibur,1,satisfaction,positive
pemain nya pada ngecheat developer sengaja nyewa pemain untuk nurunin bintang pelayer mereka bersekongkol dan bisa mengintervensi game busuuukkk semoga hancur kau game game yang tidak sportif untuk pemain,1,satisfaction,negative
monton njng ketemu musuh nabrak sinergi terus tidak pernah dikasi menang selalu saja ada yang nabrak,2,satisfaction,negative
beh game bagus ini mah bjirr saya langsung kasih bintang cuy,5,satisfaction,positive
ti ada dapat hero bagus,1,satisfaction,positive
asik asik benar benar chess,5,effectiveness,positive
untuk pengembangan magic chess go go terimakasih telah membuat magic chess sebagai pemain setia magic chesssaya sebagai player sedikit kecewa karena perubahan baru baru ini keseimbangan dalam game tidak merata banyak hero yang dihapus tapi kalau bisa tolong hero nya jangan dihapus sinergi juga banyak yang dihapus atau diganti memang untuk season ini banyak perubahanseperti contoh comander jonson yang mendapat jonny di toko sekali tabrak mati semua heromu walaupun hero mu tipe tank,3,satisfaction,negative
katanya pembaruan kok malah begini tidak akurat ada pilihan magic jaz ada saya memilih yang kartu kok tetap memilih versi lama,1,effectiveness,negative
game lu tidak menarik bang,1,satisfaction,negative
permainan banyak yang tidak adil banyak lag nya,1,effectiveness,negative
kok ada suka main game ini ya letak serunya dimana,1,satisfaction,positive
sudah tahu kan dari komen yang mengasih bintang saya disini tidak mau komen karena saya tahu tidak akan ada perubahan banyak kcurangan di game ini seolah semua dseting untuk beberapa orang,1,satisfaction,negative
bagus dan cocok untuk ketika sedang tidak tahu mengapa,5,satisfaction,positive
game bug ambil imo di kasih nana memang gangotakk gagal win,1,satisfaction,negative
mengapa saat login ulang menggunakan akun mlbb rank saya jadi turun ke warior awal nya rank saya mytic tolong di perbaiki sangat merugikan,3,effectiveness,negative
masih suka nge lag lag padahal koneksi lancar lancar saja,1,effectiveness,negative
mantap game yang cocok dikala bosan dan menyenangkan,5,satisfaction,positive
main terus sampai lupa waktu,5,satisfaction,negative
fitur voting ban nya kacau terkadang comannder yang paling banyak di vot tidak ter ban dan juga sistem matc making nya beruntung hokian hero yang kita butuhkan sering kali tidak tersedia meski stok di toko masih tersedia harapan kedepannya bisa di perbaiki lagi mooton terimakasih,3,effectiveness,positive
bagusan versi yang lama magic gogo seperti kurang saja grafik dan efeknya jadi malas main,2,satisfaction,negative
game rusak semakin lama semakin aneh padalan saya suka game ini tapi karena praturannya tambah aneh saya hapus gamenya tidak masuk akal karena tidak punya akal,1,satisfaction,negative
chill game daripada ml stressmain mc pure skill kita sendiri,5,satisfaction,negative
game rusak sinergi kok enggak imbang mm sama weapon master sudah di nerf masih saja op,1,effectiveness,negative
keren sih mc lama di tambahkan di mode mgc sekarang,5,satisfaction,positive
ganti ajun sekarang sulit,1,satisfaction,negative
game busuk roll an ampass,1,satisfaction,negative
dari pada yang lain mending game ini gga ribet,5,satisfaction,negative
kalok habis lag tidak login ulang lagi,1,effectiveness,negative
game nya kenapa ya lag lag begitu tolong perbaiki lagi ya monton,1,effectiveness,negative
oi moonton kenapa hari ini koneksi susah di game kalau buka youtube sama aplikasi lain termasuk pubg lancar saja tolong dibenahi kalau sudah bagus saya ubah lagi ratingnya,1,satisfaction,negative
sekarang sudah lebih menarik banyak kombinasi strategi item dan tampilan menawan good job lah,5,satisfaction,positive
event dari ikon sinergi sudah done semua tetapi tidak nyala saat main padahal sudah sesuai sinergi atau sinergi bug apa bagaimana,3,effectiveness,negative
the game is very relaxing very suitable for me who plays casually,5,satisfaction,neutral
game nya bagus simpel tidak terlalu harus fasthand tapi muncul mode practice untuk latihan,5,satisfaction,positive
nerf wanwan lah mincape saya main lawan wanwan yang mau giliran mau kalah malah ultigak ngotak lagi damage per matchnya,3,satisfaction,negative
monton enggak jelas kocak babi,1,satisfaction,negative
di mitic percuma saja di ban pilihan terbanyak malah di biarkan saja,3,effectiveness,negative
sering lag ping selalu tinggi kali kemenangan kali kekalahan sistemnya seperti slot di awal dikasih kemenangan setelah itu kalah,1,satisfaction,negative
mohon pahami player yang bermainuser di karenakan tiap update ada saja hero yang terlalu over power walaupun bintang rendah ataupun hero harga murah sebagai contoh yang sekarang moskov terlalu op dibandingakn yang lain dan update sebelumnya karina yang full nge dodge sayang sekali loh padahal game nya konsep nya bagus tetapi begitu padahal sebelum hadir magic chess gogo magic chess yang dahulu lebih stabil dan lebih tidak ngebosenin karena bisa saling counter strategi mohonpertimbangkan,1,effectiveness,positive
semoga lebih baik lagi,5,unknown,positive
gamenya lucu imut menggemaskan,5,satisfaction,positive
sangat menyenangkan menghibur untuk waktu luang,5,satisfaction,positive
game stres sudah dapat biji eru dari ggc gilirin mengasih blessing ngawur masa iya reset blessing buat cari eru sampai kali reset duit habis cuma buat cari blessing eru apalah moonton nih membuat game selalu saja darksistem tidak ml tidak mc sama saja,2,satisfaction,negative
sudah hapus cache sudah hapus data sudah download ulang tetap saja matchmaking tidak bisa lagi eror apa bagaimana ini saya main game aplikasi lain lancar saja,1,satisfaction,negative
enak kah yang mode lama mehic go go nya,5,unknown,positive
lag wae anjing babaturan aing ku aing hospot te lag ai aing nya lag bagong magic chees bagong,1,satisfaction,negative
sekedar saran itu comander jonshon masih terlalu kuat dan harap di nerf dan sinergi dawnbringer masih terlalu op,4,satisfaction,negative
kembalikan thamuz yang dulu,5,unknown,neutral
game lag tambah lama dimainin,1,effectiveness,negative
grafik tolong perbaiki lag tibatiba patahpatah pergerakan hero makin sini makin banyak bug,1,effectiveness,negative
overall gamenya bagus cuma kalau bisa mode practice itu ditambahkan lah buat player karena terkadang gamungkin juga kita uji coba kombo sama cara kerja commander baru di ranked match karena kalau di ranked match itu sudah pasti kalah kalau tidak tahu cara main commander nya,4,satisfaction,positive
setelah di updete koneksi nya lag parahhh padahal jringn nya bagus bagus saja taiii,2,effectiveness,negative
tolong commander miya sama karina itu moonton membuat permainan tidak seimbang lebih baik di ganti itu commander,1,satisfaction,negative
banyak ngelegnya padahal ponsel dan koneksi sudah support,1,unknown,negative
kok begini gamenya error eror mulu keluar terus padahal koneksi lancar ayolah kasihan nih pada mau menang malah error mulu,2,effectiveness,negative
game nya sudah bagus tapi tolong dong kasik tambahan sedikit waktu saat sebelum warr biar kita bisa mikir lebih lama terkadang belum kasik aitem sudah di mulaii tolong dong di perbaiki,5,satisfaction,negative
game pemberi harapan palsu php,4,satisfaction,negative
tolong lah kalau mengasih lawan yang adil yang rank nyasetara saya rang legend ketemu lawan yang sudah pernah ke rank mitic secara logika kemampuannya sudah jauh di atas saya,1,satisfaction,negative
yang jadi masalahnya adalah yang diban tidak sesui dengan yang di vote,4,satisfaction,negative
awas guis game ini bisa gila,1,effectiveness,negative
bagus gemanya gerafinya sama aepeti gema asil nya,5,satisfaction,positive
saya suka animasi ok lebih upgrade lagi moonton,5,satisfaction,positive
seru sekali dan ini saya dawunlod karena di ajarkan kakak ku,5,satisfaction,positive
sering menghubungkan ulang padahal koneksi bagus aneh scrol hero juga kgk di kasih sudah keluar duit banyak sedangkan lawan hero golf di kasih bintang tidak sesuai deh sekalinya menang juara game selanjutnya kgk di kasih hero sama sekali aneh,1,satisfaction,negative
kalau sudah mau bintang jangan dipersulit lagi rollan nya muntun,5,satisfaction,negative
enakan magic cheas yang dimlbb daripada sekarang semakin lama semakin aneh enggak logis lagi jangan download game ini deh gue pensi main mcgg,1,satisfaction,negative
game susah sekali cari hero yang di ingin kan jir,1,effectiveness,negative
tolong tambahkan fitur jeda dwonload,1,effectiveness,neutral
game tolol iklam tidak guna saya download biar bisa bintang satu ilangin saja game tidak guna,1,satisfaction,negative
cocok sekali buat dijadikan game teman di jam kosong,5,satisfaction,positive
game bagus pokoknya game paling juara yang ada di dunia monton baik soalnya,5,satisfaction,positive
nih game bagus sekali sangat menenangkan dan asik,5,satisfaction,positive
menang kali kalahnya kali mantepp,5,satisfaction,positive
