Ulasan,Rating,Aspek,Sentimen
gema nya burik masa sinyal normal tibatiba lag,1,effectiveness,negative
game deh bagus tapi hero pasukan tolong membanyaki dikit soalnya mau menang tapi hero tinggal dikit jadinya kalahsinergi tidak jelas sekali hero sangat mahal bintang hero jadikan sampai bintang sama hero damagenya dikit sekali kurang besar map kurang luas tolong update lebih bagus lagi,3,satisfaction,negative
tolong perhatikan bugshop sudah saya kuncinamun kenapa babak selanjutnya malah ke refresh sendiriperbaiki bugbukan hanya ingin buff sinergi yang tidak logis,2,satisfaction,negative
tidak jauh beda sama abang nya nih game jelek kali sistem matchmaking nya,1,satisfaction,negative
game nya sangat keren dan jmbt,1,satisfaction,positive
tolong heronya jangan yang aneh dapatnya,5,effectiveness,negative
game yang tidak adil saat mau mengadu keluhan tidak bisa kirim foto bukti auto un install buat kalian yang punya riwayat darah tinggi mending jangan download mc enggak,1,effectiveness,negative
tahi bisanya ada yang memakai cheat tiba konek putus keluar game masuk lagi malah tidak bisa,1,satisfaction,negative
burik makin di update,2,satisfaction,negative
ok rate untuk kesamaan sinerginya di tambahkan sedikit lagi,5,satisfaction,neutral
setiap kali update harus download data lebih dari setengah versi lama apakah karena kontennya semua baru atau bagaimana,4,unknown,neutral
magic cristal nya membanyaki,1,effectiveness,positive
game cacad season baru malah membuat malas main kebanyakan hero ini itu sinergi tidak jelas menjadi seperti belajar dari nol lagi,1,effectiveness,negative
banyak bug yang harus di perbaiki mohon di perbaiki secepatnya,3,satisfaction,negative
kenapa sudah enggak bisa top up diamond ini saya di akun saya montoon,1,effectiveness,neutral
keberuntungan tidak menggunakan skill tergantung apa yang diberi sistem player tidak bisa mengontrol atau berusaha player jadi mainan di troll sama sistem,2,satisfaction,negative
game yang bagus dan seru dimainkan,5,satisfaction,positive
lebih baik dan praktis,5,satisfaction,positive
mcgg menurut ane kurang seru tapi ada mc yang dulu di crystal rune jadi ane kasih bintang,5,satisfaction,positive
nerf moskov plis broken parah,1,unknown,negative
koneksi bagus tiba menghubungkan kembali,1,satisfaction,positive
setelah update animasinya lumayan menyakiti mata semoga segera di perbaiki overall game bagus tapi setelah update jadi begitu,3,satisfaction,negative
balikin megic chess mlbb,1,unknown,positive
game tidak jelas ngent hero nya suka bug tolol setiap main pasti ada bug yang lain banyak game rusak,1,effectiveness,negative
alhamdulillah seru mainya meskipun lebih berat dari mlbbsuka membuat frame parah lag parahtapi rame sekali deh,5,satisfaction,positive
game rusak sama seperti ml,1,effectiveness,negative
asik menyenangkan ada diamond sama acak dan bisa mencoba atau lihat skin di magic chess go go,5,satisfaction,positive
tambah opsi pengaturan buat pindah akun dong seperti di game induk mlbb biar bisa buka akun kecil saya,5,effectiveness,neutral
main mcgg buat healing dari ml tolonglah kalau online mc di ml offlinekan saja,4,effectiveness,negative
ngemis bintang yang membuat game ini janvok,5,satisfaction,negative
kenapa tidak bisa login error kah,2,effectiveness,negative
sampai saat ini masih jadi game favorit sih,5,unknown,positive
bagus sekali commander nya yang imut dan grafik yang perfect,5,satisfaction,positive
susah mendapatkan hero yang di butuhkanjadi malasmaav saya uninstall apknya,1,satisfaction,negative
sangat bagus tapi tolong sinergi kangkung ditambah kan,5,satisfaction,positive
membuat orang emosi musuhnya beruntung kali dasar moonton,1,satisfaction,negative
algoritma masih sama dan tidak ada peningkatan,1,satisfaction,negative
bagus buat ngisi waktu luang atau saat ngumpul sama teman² bisa mabar,5,satisfaction,positive
saya ingin pengalaman yang lebih menariktolong sediakan fitur squad seperti chess rushjadi vs antar squad pasti akan lebih seruterima kasih ya,5,satisfaction,positive
kebanyakan plagiat game lain kalau sepi membuat event yang menarik perhatian sampah,1,satisfaction,negative
download dalemannya enggak bisa di tunda woi paketan saya habis,4,effectiveness,negative
game apaan hiro setiap sinergi cuma enak tapi di sinergi game kocak,2,satisfaction,positive
game ampas muak sekali sama sistem permainan nya persentase hero yang di butuhkan sesuai sinergi susah dapat nya parah sekali membuat frustasi game busuk sama saja seperti mlbb lama saya uninstall,1,satisfaction,negative
game enggak jelas seperti tarohan beruntung,1,unknown,negative
akun google tidak bisa di menggunakan dan hilang,1,satisfaction,negative
server masih lag sekali monton,2,satisfaction,negative
moonton mencuri diamond sudah top up juta malah tidak dikirim,1,effectiveness,negative
kalau bisa kasih mode offline nya moontoon,4,unknown,neutral
sering saat match tiba koneksi terputus padahal saat kucoba buka youtube lancar saja tolong segera dioptimalkan kan masalah koneksi ini moonton biar kita sebagai player kalau main nyaman mainnya,3,satisfaction,negative
seru dan sedikit lebih baik dari pada mlbb karena bermain dan membuat strategi sendiri tidak seperti mlbb,5,satisfaction,negative
please balikin vitur magic chess yang di mlbb,1,unknown,neutral
sangat membantu di saat bosan,5,satisfaction,positive
setelah di update lagi resolusi gambarnya perfect characternya lucu lucu dan game mode nya makin banyak pokoknya seru deh,5,satisfaction,positive
tolong manajemen kontenya bisa dipilih cukup bagian penting saja jadi handphone ram kebawah bisa main dengan smooth,4,effectiveness,positive
games yang menarik bagus,5,satisfaction,positive
makin seru sih karena di pisah sama mlbb,5,satisfaction,positive
versi ampas game tidak jelas beruntung hokiannya tertara sekali developer tolonglah yang benar kau buat versi modelan begini dibilang pembaruan tambah rumit saja mainya assasin kok jalan positioning ke baris depan semua lu kira pager betis main wr naik turun tidak jelas mending buruan update saya mau main versi nostalgia bodoamat sama pembaruan lu,1,satisfaction,negative
i really like felly,5,unknown,positive
permainan ini sangat bagus dan menyenangkan,5,satisfaction,positive
koneksi koneksi nya di betulin padahal koneksi lancar jaya tapi tetap enggak bisa buat di mainkankalau masalah bug begini saja enggak bisa di betulin bagus hapus aplikasi ini saja sudah dari playstoree,1,satisfaction,negative
bisa offline tidak sih seperti ml,1,unknown,neutral
entah kenapa di ini game selalu lag padahal kecepatan internet aman semua,2,effectiveness,negative
game nya sangat menarik sangat rekomended untuk mengisi waktu luang,5,satisfaction,positive
ini kenapa sih kok jadi error begini mcgg lagi enak enak main tiba tiba ada bacaan error tidak diketahuisilahkan coba lagi nanti sudah relog berapakali tetap saja muncul seperti begitu terus,2,effectiveness,negative
game seru cocok untuk mengisi waktu luang,5,satisfaction,positive
game aneh tiba tiba data ke riset sendiri balik ke awal lagi,1,unknown,negative
cukup seru dan sangat sangat eh hebat,4,satisfaction,positive
mohon di update kedepannya untuk koneksi servernyamasa setiap main lag mulu ping merah terus bagaimana mau main kalau seperti begitu,3,effectiveness,negative
sinyal tiba tiba hilang,1,satisfaction,negative
jujur saya lebih suka sinergi yang dulu tapi enggak apa-apa lhh,5,satisfaction,positive
dikit² nerf dkit² nerf nerf tuh wm mm tapi jangan band yang lain jugakk,1,effectiveness,negative
game jelek sistem di lawan hehe rusak,1,satisfaction,negative
tolong dong game ya di hapus saja tidak seimbang mau terhibur malah kena dark sistem satu kali juara berkali kali kalah saya sangat kecewa moga masih bisa bertahan perusahaan game ini di indonesia,1,satisfaction,negative
saya suka game yang mini,5,satisfaction,positive
gema burik ah saya kalah mulu deh cape cape bintang malah kalah dasar moonton kalau buat gema yang gampang lah,1,satisfaction,negative
game keren dan menyenangkan,5,satisfaction,positive
lebih buruk daripada magic chess masih barang mlbb sering sekali lag,1,effectiveness,negative
skip tutorial tidak jelas sudah punya akun ngebosenin,1,effectiveness,negative
game tidak adil kalau mau kasih item kasih semua di player item yang sama kasih kartu yang sama biar player yang pilih,3,effectiveness,negative
makin kesini makin tidak jelas naik legend saja susah ada saja halangan hero sering gadikasih lah aitem jelek semua lah kagak jelas skip,1,satisfaction,negative
enggak jelas haya dan haya,1,unknown,negative
pengurangan ponsel terlalu banyak lawan hanya sisa hero tapi bisa dari semua game chess ini yang paling sampah untuk sistem dmg saat kalah,1,satisfaction,negative
kalau buat game yang jelas ya tim yatim,1,satisfaction,neutral
ini game bagus sekali tapi agak bosenin karena sinergi nya dikit heronya juga dikit tapi kalau game ini sudah ada semua hero yang ada di ml bakal seru sih nanti sinerginya dibanyakin lagi hero ketika ini game juga,3,satisfaction,positive
game nya bagus percuma kalau mau masuk ke game nya lama dan tidak gampang bosan,5,satisfaction,positive
game yang bejobejoan kalau tidak beruntung dapat hero bagus ya pasti kalah mau se effort apa utak atik strategi kalau tidak compatible hero ya looseee strike,1,effectiveness,negative
tahu ini dari teman yang magic ches lucu,5,satisfaction,positive
game ta saya mencari hero yang smaa saja tidak ketemu,1,effectiveness,negative
makin parah mcgg sinyal dll tidak nayaman,1,satisfaction,negative
saya download cuma buat mendapatkan skin mcgg,1,satisfaction,neutral
sekarang tidak ada lederboar buat yang lokal atau server menjadi tidak ada tantangan buat main menjadi malas,5,satisfaction,negative
ribet tidak konsisten senangi saja itu roll bawah,1,satisfaction,negative
aplikasi bagus buat yang lagi bosan,5,satisfaction,positive
baik disimpen buat cari bintang maupun diabisin untuk cari bintang sama saja kagak hasil montoon kagak jelas,1,satisfaction,negative
yang belum kasih rating silahkan berikan bintang,1,satisfaction,neutral
terus di tingkatkan lagi biar makin seru,5,satisfaction,positive
seru sekaleee biasa main ml pindah ke mcgg hha,5,satisfaction,positive
game taekkmenang kali kalah berkalinaik bintang atau main lagi kalah berkali hilang bintang sekaliguspermainan tidak seimbang sekali sudah diatur sistemmau level n bintang kekuatan setinggi apapun kalau sudah diatur sistem kalahtim tidak akan terasa demage sama sekali ke lawangame apaan seperti begini,1,satisfaction,negative
enggak jelas main sampai jam stuck di situ situ saja cape mata cape hati saya main game beginian perasaan dulu magic chess tidak begini deh mau push juga gampang,2,satisfaction,negative
malesnya update menggunakan segala download data,2,satisfaction,negative
game tidak balance di koneksi saya main di saat late game di penentuan final malah terjadi koneksi terputus selama menit dan sering terjadi dan saya cek koneksi saya ping di mssaya cooba buka sosmed normal dan tidak ada kendala di koneksi saya device saya realme pro dan ram gb ram tersisa gbsangal konyol game untuk di main kangak balance,1,satisfaction,negative
pantas ratingnya gamenya memang se tidak jelas itu apalagi dengan adanya mode crystal rune malah makin tidak jelas gamenya menurut ku memang sudah sepantasnya ratingnya segitu tidak lebih,1,effectiveness,negative
kebanyakan ngunduh konten anjir,2,unknown,negative
setiap menghubungkan ulang tidak balik ke game,1,satisfaction,neutral
menarit dan seruh susa untuk menang,5,satisfaction,positive
geam ini seru benget perantau saya main geam ini di toilet selama jam,5,satisfaction,negative
game dengan sistem broken,1,unknown,negative
game pekok sinyal bagus enggak bisa dibuat main,1,satisfaction,negative
sinyal bagus ini game lag sekali putusdapet musuh yang beruntung parah selalu dapat kristal di ggcard awalsedangkan sini mah boro kristal tidak pernah dapat rolan busuk bangetkeliatan sekali pilih kasihrusak rusak,2,effectiveness,negative
baru masuk sudah ada koneksi bermasalah padahal koneksi full,1,effectiveness,negative
seru sekalih yang buat game ini mantap,5,satisfaction,positive
tidak mengerti cara main,4,unknown,negative
game nya seru cukup menghibur untuk saya tidak ada masalah di dalam game ok lah,5,satisfaction,positive
montoon tambahkan herk tigreal nanti tambahi satu bintang lagi,4,satisfaction,neutral
ini game bukan judol tolong jangan memanipulasi sistem buat kondisi game yang adil bukan dark sistem membuat suami saya muaakkkkkk,1,satisfaction,negative
kok di layar cuman hitam ya tolong perbaiki ya,2,satisfaction,negative
saya kecewa sama game nya meskipun seru saya sungguh kecewa crest saya di event draw ling magicalchou hero itu sudah dan saya topup tetapi saya hanya mendapat crest saya jadi sangat kecewa tidak bisa beli ling cc karena saya sudah beli mahal tetapi tidak dapat,2,satisfaction,negative
please memakai the synergy like before so you can get itu ini round,4,effectiveness,neutral
bang kenapa tidak semua hero saja bang nanti saya kasih bintang plis semoga dibaca,4,effectiveness,negative
main enak dulu sekarang di persulit enak kembali ml lagi,1,satisfaction,positive
heh monoton kalau membuat update yang masuk akal dikit lah masa hero epic di kurangi stok nya lu tahu tidak dengan update seperti begitu membuat banyak palyer roll bawah dan itu meresahkan bagi player roll atas tolong di koreksi lagi update nya bagaimana game nya mau rame kalau tidak ada kebijakan,1,satisfaction,negative
game tolol banyak bug nya stok hero gold dikurangin jadi makin ampas nih game memang game moonton kagak ada yang benar,1,effectiveness,negative
karena ada tulisan moonton,1,unknown,neutral
intinya favorit nih game,5,effectiveness,positive
bagus yang di ml asli daripada yang ini,1,satisfaction,negative
go go card tidak seimbang hero yang sinerginya bersangkutan susah dapetnya game tidak jelas,1,satisfaction,negative
di awal² mah seru tapi sekarang tidak bisa login kalau menggunakan data seluler,1,satisfaction,negative
baru ketemu chiter lvl comender baru hero harga sudah max semua ketemu kali lagi ke dua comender lvl hero legend lvl ada brody dan gatot pantas banyak unistal game buat citer mending di hapus sih sudah enggak minat push lagi saya apa lagi mainin lagi gamenya seperti buat para citer doang dahlah game buat ladang citer membuat sinyal lag tiap malem di magic go go nastalgia sudah game mbosenin banyak citernya lagi kalau main malem di atas jam maleman sudah yang main para citer menyebab lag,1,satisfaction,negative
bagus untuk sinyalnya lag,5,effectiveness,negative
untuk magic chess go go ini tolong anu ya sudah,5,effectiveness,neutral
keren buff lylia kenapa,5,effectiveness,positive
terlalu banyak hero tidak guna termasuk yhuzon hero gold tapi tidak jelas arahnya mau kemana dan banyak kejanggalan di slot masa hero gold susah muncul game rusak,1,satisfaction,negative
wey tolong dibuat seimbang masa iya orang menggunakan sinergi banyak bisa rata dapat heronya sedangkan saya menggunakan sinergi yang kagak banyak orang menggunakan tapi susah nya meminta ampun buat mendapatkan hero nya sekian thanks,3,satisfaction,negative
ngotak lah kalau kasih blessing sudah di reset seribu kali masih tetap sama kocak,1,satisfaction,negative
sudah tidak bisa lagi kita main magic chess harihari gord kaja emberlord esme guin angela suport mereka yang cuman bintang mampu kalahkan kami yang setengah mati ngumpulin hero bintang,1,satisfaction,positive
bagus bisa main sambil santai,5,satisfaction,positive
game bagus untuk dijadikan sebagai bahan di dunia,5,satisfaction,positive
mantap membuat orang strees,5,satisfaction,positive
min tolong nerv umberlord atau moskovnya terasa terlalu op moskov bintang saja sudah tidak ada conternya menurut saya,5,effectiveness,negative
average is good but my suggestion ada chess tadi please we chess tadi fan really miss that feature,5,satisfaction,neutral
saya uninstall gamenya karena bosan download resource setiap kali gantiganti server seharusnya data sdah tersimpan malah harus download kembali,1,satisfaction,negative
terima kasih sekali sudah nyedia ini lagi mc yang dulu,5,satisfaction,positive
gamenya asik seru dan santai,5,satisfaction,positive
lumayan sih tapi kembaliin sinergi kangkung cowok saya suka memakai joy sama kadita,3,satisfaction,positive
masih sulit karena saya pemula,3,satisfaction,negative
mntp tapi akun lamanya tidak tertaut,5,satisfaction,neutral
game yang cocok buat orang yang beranjak masa tua wkwk,5,satisfaction,positive
kasih lawan yang seimbang lah,1,satisfaction,positive
game yang sangat bagus untuk waktu luang,5,satisfaction,positive
kok tidak ada commander lunox dan valir padahal sudah update,3,unknown,negative
mohon melakukan perbaikan pada koneksi,1,satisfaction,neutral
kurang seru mc gogonya lebih seru era bintang,2,satisfaction,positive
game nya menantang dan seru bisa bantai bantai,5,satisfaction,positive
pindah sini dulu di ml losestreak terus mc enggak keren sih,3,satisfaction,negative
wah game yang sangat ramahh,5,unknown,positive
min saya masih ada kekrngn nih sama game nya alangkah lebih bgusnya kalau mau memperbnyak peminat untuk gmnya sendiri ini mnrut saya pribadi kalau bisa di membuat mode rnked versi duo seperti di mode tag team begitu min jadi kalau mislnya kita mau main bareng teman tidak mesti satu tidak harus jadi musuh ya namanya mabar itu kan harus setim kan malah membuat sebliknya tidak enak min mabar sama teman ehhhh tautau saat main jadi musuh ya gue tahu nih game srategi tapi kurang saja begitu min kalau tidak ada mode duo nya trmh kasih permisi,4,satisfaction,negative
sistem blessing kenapa ada lagi membuat malas main mencari item atau crystal saja dusah,1,satisfaction,negative
sangat menyenangkan buat pelayer mlbb,5,satisfaction,positive
untuk commandernya masih op waktu di mcbb sih lebih seru ada skill nya dan agak kecewa kami player vale skill sama sudah dihilangkan,5,satisfaction,negative
game enggak jelas kalah menang di atur sistem,1,satisfaction,negative
game rusak tidak jelas bisa main langsung eror memang game jelek ini,1,effectiveness,negative
game ini cocok untuk waktu santai ditemani segelas kopi,5,satisfaction,positive
gamenya belum stabil mau beli hero rolling atau ambil item di fate box sangat slow respon bisa delay sampai detik padahal sinyal saya sangat stabil untuk bermain game lain saya sangat terganggu dengan masalah ini tolong diperbaiki lagi,5,satisfaction,negative
ok jug ini permainan nya,1,satisfaction,positive
tolong sedikit di perbaiki dalam pemberian hero nya jangan di persulit tolong lah perjelas pemberian mau itu belssing hero item atau cristal sinergi nya di persulit sekali tolong lah di perbaiki secepat nya,5,satisfaction,negative
gemnya seru haru di mainin setiam hari atau kalian terlambat ambil even dan bisa dimainin di moba atau pun pisi,5,satisfaction,positive
gtau kenapa tiba tiba selalu stuck loading menu game tiap mau masukgprnh sampai masuk login padahal sebelum nya normal normal ajaudh di un install dan di coba beberapa cara tapi tetap gbsaakhirnya sampai sekarang pun masih tidak bisa masuk dan cuma stuck loading menu selama hari ini,1,satisfaction,negative
i love this game perfect,5,unknown,positive
mantap gamenya tidak membuat bosan,5,satisfaction,positive
meminta tolong di perbaiki buat random blessing sama heronya main kali kali juga hero tidak pernah keluar blessing acak semakin kesini bukannya buat seneng² malah buat stres mending uninstall,1,satisfaction,negative
buat mode lain lah,4,unknown,positive
bagus saya lagi pelajarin cara main game nya,4,satisfaction,positive
game busuk tidak jelas,1,satisfaction,negative
kasih aurora skin mythic bang,5,satisfaction,neutral
goblog hanabi bintang tidak ada damage dikasih item tiga seperti tolol,1,satisfaction,negative
makin ke atas makin susha musihnya,5,satisfaction,positive
permainan ini sangat bagus saya suka,5,satisfaction,positive
season makin anehsaya mau main sinergi astro tapi hero dari sinergi astro tidak muncul² mpadahal yang main sinergi astro hanya saya,1,satisfaction,negative
saya tidak man di pc kok suruh main di pc sih min bagaimana,1,satisfaction,negative
tidak bisa berkata² game startegi terbaik saya kasih bintang lima,5,satisfaction,positive
tambahkan event vanguard coint di advance server,5,satisfaction,neutral
buf guinn hapus roll bawah monton peliss saya mah,1,satisfaction,neutral
yuzhong nya hero ampas bug gakmau ulti,1,satisfaction,negative
balikin magic chess seperti dulu lagi tidak usah pakai aplikasi tepisah sama mobile legend,1,satisfaction,negative
deh bagus sihefennya saja kurang,4,satisfaction,negative
tidak seruh tidak ada mode practice,1,satisfaction,negative
nyedot data nya tidak ngotak coo dari gb jadi gb,1,unknown,negative
bagus ws terus saya karena saya jago,5,satisfaction,positive
semenjak update jadi aneh nih game,1,satisfaction,negative
tolol hanya satu hero bintang bisa menang melawan hero bintang terlebih astro,1,satisfaction,negative
lebih sedikit di tingkatkan bug nya biar makin sepi nih game minimal ada pemberitahuan kalau ada perbaikan server anjir,1,satisfaction,negative
moonton coba ling di buff seperti ginisetiap mengeliminasi lawan di dalam ring akan meng copy hero yang berada dalam ring,5,satisfaction,neutral
dark sistem tidak ngotak,2,unknown,positive
game asbun kagak jelas,1,unknown,negative
cocok sekali buat saya yang sering sering stres main main game mobanya banyak dark sistem koneksi sering lag di game ini setidaknya bisa menghibur lah dari stres ku thank you,5,satisfaction,positive
apalah kenapa tidak bisa dibuka aplikasinya,1,satisfaction,negative
game nya bagus wkkkkkw,5,satisfaction,positive
comander lama masih dibikin op yuki kalau moonton tidak bertindak saya yaqin setelah akhir bulan saya akan tegas meng uninstall game ini,1,satisfaction,neutral
mcgg sangat bagus dan realistis,5,satisfaction,positive
mendingan aplikasinya kembali seperti dulu lagi sekarang skin skin yang dulu pernah beli atau dapat hilang saat sudah rilis mcgg begini tolong diperbaikikan min yang baru comeback menggunakan akun saat melihat akun nya skin nya kok ada kurang jadi malas main,1,satisfaction,negative
game scamgame beruntung hokian tidak fair,1,unknown,negative
lagi malas main ml,5,satisfaction,negative
pengalaman bermain tidak sesuai dengan persentase kemunculan hero dengan sinergi yang dimainkan sangat merugikan player,2,effectiveness,negative
game keberuntungan cuman sekalinya tidak beruntung enggak ada hero yang diinginkan sama sekali,3,satisfaction,negative
mantap awalnya tidak tertarik tapi setelah mencoba seru juga deh wkwkw,5,satisfaction,positive
game tidak jelas game tolol pilih kasih,1,effectiveness,negative
gamenya sudah bagus min tapi keberatan min tolong kasih fitur ringan seperti di ml biar ponsel kentang bisa main,4,satisfaction,negative
game tolol game tolol ngurus ml saja kga becus so soan dipisahin kacau moskov terlalu op komander wawan terlalu op tod,1,effectiveness,negative
lebih nyaman game gogo di gabungkan lagi di mobil legend seperti dulu tidak suka di pisah atau di buat aplikasi sendiri itu membosan kan buruk sekali,1,satisfaction,negative
tolong kasih fitur skip tutorial,1,effectiveness,neutral
tidak ada mode practice mode untuk mencoba comander dan hero lainnya di haruskan adaptasi tanpa intruksi cara bermain sinergi dan combo mohon adakan untuk semua orang agar di adakannya practice mode,1,satisfaction,neutral
permainan ini sangan seru dan membuat saya ketagihan,5,satisfaction,positive
mudah saya bisa di beri kemudahan mendapatkan hero yang di rekomendasi minimal bisa sampai rank tertinggi love you,5,satisfaction,positive
gamenya unbalance kalau sering top up akan menambah keuntungan di roll hero,3,satisfaction,positive
nerf commander ww sakit sekali skilnya enggak jelas,5,unknown,negative
sangat seru tapi makin besar ukuran aplikasinya,5,satisfaction,positive
we tol lu kalau buat fiturai minimal pintar dikit lahdah tahu sinergi ku tidak ada yang memakai tapi malah tidak dikasihdah setok hero masih banyak lagilu mending belajar sama game sebelahmonton itu memang orang enggak bk tidak bisa buat fitur gameto l o lcuma plagiat game lain,1,effectiveness,negative
mencari blessing apadapet nya apa sampah memang sudah di jual malah sama saja tidak jelas game buatan moonton ini,1,satisfaction,negative
abang abangan ml pindah deh kesini,5,satisfaction,negative
game nya bagus cocok buat untuk anak jaman new game nya seperti catur,5,satisfaction,positive
game ini banyak kecurangan seperti wan wan dan miya tolong serangan mereka di kurangi tidak seimbang soalnya,1,satisfaction,negative
jangan lupa sholat game keren asik santai fokus,5,satisfaction,positive
terimakasih sudah kembaliin skill miya,5,satisfaction,negative
nature spirit kenapa di hapus moonton untuk saat ini bintang satu saja,1,satisfaction,negative
game nya mudah dipahamihero alucard kapan min jadi comander di mcgg,5,satisfaction,positive
mc bodoh game tidak imbang,1,satisfaction,negative
game nya seru tapi suka freeze suka lag tidak seperti mobile legend bang bang payah mohon di perbaikilah,2,satisfaction,negative
semoga tambah berkembang magic ches go go,5,satisfaction,positive
sinyal jringan bagus sinyal wifi kencang tapi kenapa ya kok tiap mau main sering ggal sambunganhmmm game yang lain nya lncar enggak ada kendala aduh jadi bintang dulu,1,satisfaction,negative
rata² yang kasih bintang pada tidak bisa main ini game banyak mengeluh justru ciri khas dari game chess ini ya pasti banyak perubahan dan gambling harus pintar ngotakngatik main menggunakan otak sejak jaman main chess rush sudah familiar dengan banyak perubahan di dalam gamenya kalau kalian yang kasih bintang tidak mau repot dan tidak mau menggunakan otak kalian ya jangan mengeluh kalau perlu tidak usah main bacot seperti paling jago saja,5,satisfaction,positive
lumayan menghibur di waktu luang,5,satisfaction,positive
